factory_name,address,source,extraction_date,page_number,worker_count,latitude,longitude,geocoding_method,geocoding_confidence,identified_brands,brand_confidence,num_brands,primary_brand,max_confidence,brand_tier
"PATENGA, CHITTAGONG-4202. BANGLADESChittagong Chittagong 4202 88 800153 156 113 No No 13 342 No Yes 1Beximco Apparels Ltd Beximco Industrial Park,Kashimpur Gazipur Dhaka 2 8611464 115 No No 7800 Yes No 3 Beximco Fashions Ltd. Fs-Sfb No.-2, Depz, Ganakbari, Savar Dhaka Dhaka 1349 2 7701126 114 No No 2300 Yes No 2 BG Collection Ltd. Baniarchala, Bhabanipur, Gazipur 2 812926178 No No No No 2 BHIS Apparels Ltd671 Dattapara, Hosain market, P.O  P.S",,Accord 2014,2025-09-22T21:15:10.921685,5,,24.0234,90.3912,exact_location,high,[],[],0,,0.0,unidentified
"TongiGazipur Dhaka 2 9816880 21721 No No 2800 No No 7 BHML INDUSTRIES LTD.KAMARJURY, NATUN BAZAR, NATIONAL",,Accord 2014,2025-09-22T21:15:10.921722,5,,23.8103,90.4125,default,very_low,['H&M'],[1.0],1,H&M,1.0,premium_fast_fashion
"UNIVERSITYGazipur Dhaka 1704 2 9293741 3122432 No No 2100 Yes No 2 Bhml Sweaters Ltd. Shorifpur, National University, Gazipur. Gazipur Dhaka 1704 88 1711218753 115 No Yes 10,1,2,4 1250 No Yes 5 Bhuyan Warmtex Pvt. Ltd. Kadda Nandun, Kadda Bazar, Gazipur, Dhaka Gazipur Dhaka 1346 88 1911693459 314 21 31 No No10,1,2,3 20",,Accord 2014,2025-09-22T21:15:10.921803,5,,23.8103,90.4125,default,very_low,['H&M'],[1.0],1,H&M,1.0,premium_fast_fashion
"30800 No Yes 1 BIG BOSS CORPORATION LTD.Lutfon Tower, 7th Floor E-13, Middle","Badda, DhakaDhaka Dhaka 1212 2 9897356 1112 Yes Yes 12, 3, 6, 7 1132 No Yes 5 BILLAH RESOURCES LTD171, Khataldia, Squib Road, Nishad Nagar,",Accord 2014,2025-09-22T21:15:10.921832,5,,23.7805,90.4267,exact_location,high,[],[],0,,0.0,unidentified
"Tongi, GazipurGazipur Dhaka 1704 2 9816842 117 No No 555 No Yes 2 Birds A  Z LTD. 113, Baipail, Ashulia, Savar, Dhaka Dhaka Dhaka 1349 2 7789395 21624 No No 1850 Yes No 8 BIRDS AZ LTD Mouchak, Kaliakore, Gazipur. Gazipur Dhaka 1751 2 9297923 117 No No 2200 No Yes 1 Birds Garments Ltd. Unit-2 Plot-113, Bai-Pail, Savar, Dhaka Dhaka Dhaka 0 35120838 No No No No 3 Birds Group Lightwear subcontract 113, Baipail Dhaka 1349 88 27789395399 21422 No No All 644 No Yes 1 BKC sweater LimitedPlot NO 212-214, Degerchala main road,",,Accord 2014,2025-09-22T21:15:10.921995,5,,23.8103,90.4125,default,very_low,[],[],0,,0.0,unidentified
"DEGERCHALA, National UNIVERSITY, Gazipur Dhaka 1704 29293242 315, 21 32 No No 1480 No Yes 5 Blithe Fashion Ltd. 10112, Barobagh, Mirpur-2 Dhaka Dhaka 1216 2 9298614 No No 300 Yes No 1 Blue Planet Knit Wear Ltd. Mulaid, Sreepur , Maona , Gazipur Gazipur 1704 88 8955859 21721 No No10,1,2,3,4,5,6 ",,Accord 2014,2025-09-22T21:15:10.922064,5,,23.8223,90.3654,exact_location,high,[],[],0,,0.0,unidentified
"20500 No No 3 Bluetex Knitwear Ltd. 1205,Kornapara,Savar,Dhaka. 88 8840554 115 No No 450 Yes No 3 BMT International Ltd.BMT International Ltd. Plot-92, Comilla EPZ,",,Accord 2014,2025-09-22T21:15:10.922105,5,,23.8103,90.4125,default,very_low,[],[],0,,0.0,unidentified
"Comilla -3500, BangladeshComilla EPZ Chittagong 3500 88 72565 11 No No 11 350 No Yes 1 Body Fashion Naogorkadda konabari,Gazipur,dhka Gazipur Dhaka 1720213346 116 No No 1135 Yes No 3 Bodystretch Bangladesh Ltd Tengury Zirani Bazar Holding 80 Dhaka Dhaka 1776330333 16 No No No Yes 2 Bonded Fashion Ltd. Shataish Gazipura , Tongi , Gazipur Gazipur Dhaka 1712 2 9816961 415213141 No Yes10,1,2,3,4  20 ",,Accord 2014,2025-09-22T21:15:10.922196,5,,23.8103,90.4125,default,very_low,['Uniqlo'],[1.0],1,Uniqlo,1.0,premium_fast_fashion
"30  401100 No No 3 Bonian Knit Fashion Ltd Latifpur, Shreepur, Sardagoni Kashimpur Dhaka 1346 2 7701330 113 No No 423 No Yes 1 Bottom Gallery Pvt. Ltd. Bulbul Towar,Digir Chala,Chandana Gazipur Dhaka 1700 2 9252016 110 Yes No 11,2,3,4,5,6,7 2345 No No 4 Bovs Apparels LtdJamur ,muchipara,hemayetpur",,Accord 2014,2025-09-22T21:15:10.922255,5,,23.8103,90.4125,default,very_low,[],[],0,,0.0,unidentified
"savar,Dhaka,Bangladeshsavar,Dhaka 1340 2 8959167 118 No No 456 No No 1 BP Garments Ltd.BP Garments Ltd. 227New 331Old, Outer","Circular Road, Moghbazar, Dhaka-1217,",Accord 2014,2025-09-22T21:15:10.922294,5,,23.8103,90.4125,district,low,[],[],0,,0.0,unidentified
"Bangladesh.Dhaka 1217 8415103 116 Yes Yes 411 No No 2BP Wears B-189, BSCIC Industrial Estate, Tongi Gazipur 1710 9815309 114 Yes Yes 1G,1,2,3 1125 No Yes 1 BRANDIX CASUALWEAR BANGLADESH Plot 61-71  85, E.P.Z Comilla Chittagong 88 71082 51121314151 No No 3000 Yes No 2 Britex Sportswear LtdParijat, Konabari, Gazipur,Dhaka, Gazipur Dhaka 1700 9298880 117 No No 11, 2, 3, 4, 5 700 Yes No 2 BROTHERS FASHION LTD 29, Karwan Bazar, Dhaka Dhaka Dhaka 1215 1 1 1111 No No 1000 No Yes 2 CA Knitwear Ltd. Bhobanipur, Gazipur, Dhaka Gazipur Dhaka 1700 88 9860445 313, 13, 11 No No 1200 No No 5 Cadtex Garments Ltd Kutubail, Fatullah Narayanganj Dhaka 88 1678039911 17 21 No No 1925 No Yes 2 Caesar Apparels EXTENSIONBISIC INDUSTRIAL AREA, BLOCK-A, PLOT",,Accord 2014,2025-09-22T21:15:10.922475,5,,23.8979,90.4026,exact_location,high,"['C&A', 'PVH']","[1.0, 1.0]",2,C&A,1.0,value_fast_fashion
"A2, TEA BOARD, BAIZIDChittagong Chittagong 4210 31 2584409 No No 319 No Yes 1 CAESAR APPARELS LIMITED.82, NASIRABAD INDUSTRIAL AREA, BAIZID","BOSTAMI ROAD.Chittagong Chittagong 4000 31 2584003 16 No No 1248 Yes No 1 CALM DENIMS LIMITED289-ASHRAF ALI ROAD, KOTWALI,",Accord 2014,2025-09-22T21:15:10.922517,5,,22.252231353231117,91.80315890176017,area_match,medium,['C&A'],[1.0],1,C&A,1.0,value_fast_fashion
"CHITTAGONG.Chittagong 31 625172 No No No No 1 Camio USA Knitwear Ltd. Kadda Nandan,Kadda Bazar , Joydebpur Gazipur Dhaka 1700 88 1713490252 21321 No No 10,1,220 650 No No 1 Camlet Fashions Ltd 24Ka shahid minar road, Kallayanpur 2 9010708 No No No Yes 1 Canvas Garments Pvt Ltd301,North Nasirabad IA ,Baizid Bostami","Road,Chittagong-4209,BangladeshChittagong 88 1730313118 116 No No 830 No Yes 1",Accord 2014,2025-09-22T21:15:10.922629,5,,23.9989,90.4203,exact_location,high,['C&A'],[1.0],1,C&A,1.0,value_fast_fashion
"Capital Poshak Ltd.House  18 Road  34 Sector  7, Uttara ",,Accord 2014,2025-09-22T21:15:11.021585,6,,23.8759,90.3795,exact_location,high,['C&A'],[1.0],1,C&A,1.0,value_fast_fashion
"Dhaka - 1230 - BangladeshDhaka Dhaka 1230 88 79124613 515 23 3243 57 No No 12 24, 5, 7 1590 No Yes 1 Capri Apparels LtdB-193 BSCIC Industrial Estate , Tongi Gazipur Dhaka 1710 2 8118129 116 No No 1590 No No 6 Capri Garments B-193, BSCIC Ind.Estate, Tongi, Gazipur 88 1817298625 116 No No 13,5 476 No Yes 3 Carlos Leather Fashion Ltd. Teknog Para, Joydebpur, Gazipur Gazipur Dhaka 1702 88 1713246407 112 No No 1000 Yes No 1 Cassiopea Apparels Ltd 10087 Bokran Gazipur Dhaka 88 682555266 51721314151 No No 1124567 2155 Yes No 2 Cassiopea Clothing Ltd Plot  1098, Ahalia, Torag Dhaka Dhaka 1230 2 7671112 3 116 No No 400 Yes No 1 Cassiopea Fashion Ltd Bokran, Monipur, Vobanipur Gazipur Dhaka 2 8618220 7 51721314151 No No 1124567 3034 Yes No 4 Cassiopea Garments Ltd PKA Cassiopea",,Accord 2014,2025-09-22T21:15:11.021815,6,,23.8979,90.4026,exact_location,high,['C&A'],[1.0],1,C&A,1.0,value_fast_fashion
"Fashion Ltd Unit 4LK Plaza, Holding No.-90, Dakkinkhan Dhaka Dhaka 2 7672713 14 117 No No 1G,2,4,5 1303 Yes No 1 Centex Textile  Apparels Ltd.C.B. 2303, Kachukhet, Puran Bazar, Dhaka","CanttDhaka Dhaka 2 9870067 116 No No 1600 No Yes 5 CENTURY_1314289Masdir, Fatulah Naryaangong 1400 Dhaka",Accord 2014,2025-09-22T21:15:11.021863,6,,23.8103,90.4125,district,low,['C&A'],[1.0],1,C&A,1.0,value_fast_fashion
"BangladeshNaryangong 88 1711561763 113 No No 550 Yes No 2 Chaity Composite Ltd. Chotto Shilmondi, Tripurdi, Sonargaon Narayanganj Dhaka 1440 88 1912391193 6152331415161 No No 1800 No Yes 7 Chancellor Garments Ltd. Plot No. 38, Road 4, Shikder Realstreet 2 1712008724 No No Yes No 2 Chantik Apparels Ltd.Plot  Holding No. 01 5th Floor, Turag",,Accord 2014,2025-09-22T21:15:11.022007,6,,23.6489,90.5967,exact_location,high,[],[],0,,0.0,unidentified
"Housing Ltd. Beribadh, MohammadpurDhaka Dhaka 2 175132678 No No Yes No 1 Chantik Garments Ltd. Kumkumari, Gouripur, Ashulia, Savar, Dhaka Dhaka Dhaka 2 1762981714 No No Yes No 7 CHERRY INTIMATE LTD.Plot no 105, Dhaka Export Processing Zone",,Accord 2014,2025-09-22T21:15:11.022053,6,,23.7571,90.3584,exact_location,high,[],[],0,,0.0,unidentified
"DEPZ Ganakbari,Dhaka, AshuliaDhaka Dhaka 1349 2 7790892 111 No No 700 No Yes 4 Cherry Knit Wear Ltd. Saravo, Kashimpur,, Gazipur,, Bangladesh Gazipur Dhaka 1346 1 No No No No 1 CHITTAGONG ASIAN APPARELS LTD 132 Nasirabad Industrial Area Chittagong Chittagong 88 614440 416243241 No No 2800 Yes No 2 Chittagong Fashion Specialized Textile Ltd. Plot 26, Sector  01, road  04, C.E.P.Z. Chittagong Chittagong 31 1730035550 No No No Yes 5 CHITTAGONG FASHION WEAR LIMITED6606, SOUTH HALISHAR,","BANDAR,CHITTAGONGChittagong Chittagong 4214 31 741405 3162635 No Yes 33,4 2580 No Yes 1 CHITTAGONG KNITWEAR PVT LTDPlot No 17 and 18, Sector No 4, Export Processing Zone, Chittagong, BangladeshChittagong Chittagong 4223 31 741594 21221 No No 12 21 1500 No Yes 5 CHOICE GARMENTS LIMITEDFIDC ROAD, BSCIC INDUSTRIAL STATE,",Accord 2014,2025-09-22T21:15:11.022138,6,,22.24977048588878,91.80263155794212,area_match,medium,[],[],0,,0.0,unidentified
"KALURGHAT.Chittagong Chittagong 4212 31 670301 19 No No t Shared 1500 No No 1 Chong Won ARS sweater ltd 63 North Jatrabari, Dhaka Dhaka Dhaka 2 7547063 No No No No 1 Chorka Textile Ltd. Kazirchor, Danga, Palas, Norshindi-1720 88 1924607348 No No No No 4 Chowdhury Fashion Wear Ltd. 82 Nasirabad Industrial Area Chittagong Chittagong 31 682423 No No No Yes 1 Chowgacha Fashions Ltd Kayerpara, Chowgacha, Jessore Jessore Dhaka 1922752659 415 21 32 41 Yes Yes10,1,2,3,4 20",,Accord 2014,2025-09-22T21:15:11.022351,6,,23.8103,90.4125,default,very_low,[],[],0,,0.0,unidentified
"30,1 40498 No Yes 1 Chrowdhury Garments Ltd. Taknogpara, Chandana, Gazipur Sadar, Gazi Gazipur Dhaka 1000 88 1819153180 No No 210 No No 1 Chunji Knit ltd. Satarkul Road, North Badda Plot No. 81-82 Dhaka Dhaka 1212 2 9884668 1525 No No 1800 No No 4 Chunji KnitBD Ltd 81-82,Satarkul ,Badda,Dhaka 2 9884905 21615 No No 1950 No No 2 CIDATEX APPAREL LIMITEDWard  07, Holding  J-01, Chandra, Gazipur Dhaka 88 1711533586 17 No No 17 2, 3 421 No Yes 2 CITADEL APPARELS LTD. KUNIA,K.B.BAZAR,JOY BANGLA ROAD 88 9291712 No No No No 1 CIVIC APPARELS LTD Plot 3,, Factory Road,, Gazipur Gazipur Dhaka 88 1 No No No Yes 1 Civic Fashion LtdPlot 17-18, Road  04, Section  07. Mirpur","IArea,Dkaka - 1216,1715049395 116 No No 16 648 Yes No 1 CLAMOONPlot 4, Block I, Road 6, Section 7, Mirpur,",Accord 2014,2025-09-22T21:15:11.022456,6,,23.8223,90.3654,exact_location,high,['PVH'],[1.0],1,PVH,1.0,other_brands
"DhakaDhaka Dhaka 1216 88 1 117 No No 1000 No Yes 1 clamoon garments ltd Plot No. 4, Block-I, Road No. Dhaka 1712748234 No No Yes No 1 Classic Shirts Ltd. Ka  76, Joar Shahara Bazaar, Badda, Dhaka Dhaka Dhaka 1229 2 8413358 118 No No 914 No Yes 3 Claxton Apparels  Textiles Ltd. Tarabo  Rupgong Narayangonj. Narayanganj Dhaka 2 672588445 114 No No 930 No No 3 Claxton Apparels Textiles Ltd. Hatipara, Tarabo, Rupgonj, Narayangonj Narayanganj Dhaka 1360 88 9895100 114 No No 1000 No No 1 Clifton Cotton MillsCad Plot D28,28D2 Char Rangamatia","Kalurghat Chittagong 4208CHITTAGONG 2 1911314170 16 No No 1085 No Yes 2 CLIFTON TEXTILES  APPARELS LTD180, Baizid Bostami Road,, Nasirabad",Accord 2014,2025-09-22T21:15:11.022629,6,,22.3712,91.8934,exact_location,high,"['C&A', 'PVH']","[1.0, 1.0]",2,C&A,1.0,value_fast_fashion
"Industrial A,, Chittagong,Chittagong Chittagong 4210 31 684413 510 116 No No No Yes 2 Colossus Apparel Limited Unit-2Mogorkhal, Chowrasta, National University,",,Accord 2014,2025-09-22T21:15:11.022746,6,,23.8103,90.4125,default,very_low,[],[],0,,0.0,unidentified
"Gazipur, Sadar, GazipurGazipur 88 1 No No No Yes 1 Colour  Fashion Madhkhola, Bairagirchala, Sripur, Gazipur Gazipur Dhaka 1740 2 8922684 1101112 No No 660 No Yes 1 Columbia Apparels Ltd 2281 Tin Sharak, Joydevpur Gazipur Dhaka 2 9261776 415213141 No Yes 12,3,4 2500 Yes No 1 Columbia Garments Ltd. Vogra, Chandana, Gazipur sadar Gazipur Dhaka 1700 2 8814048 1211 No No 2136 No Yes 4 COMBINED APPAREL LTD16702091, West Sholoshahar, Aturar",,Accord 2014,2025-09-22T21:15:11.022845,6,,23.8103,90.4125,default,very_low,[],[],0,,0.0,unidentified
"Depot, ChittagongChittagong Chittagong 4211 681818 No No No Yes 1 Comfit composite knit limited , unit-2 Amtola, Kathgora Bazar, Ashulia, Savar Dhaka Dhaka 1340 2 7791371 115 No No 600 No Yes 2 Comfit Composite Knit Ltd Gorai, Mirzapur Tangail Dhaka 1941 88 1912161391 13162532435161",,Accord 2014,2025-09-22T21:15:11.022909,6,,23.8103,90.4125,default,very_low,[],[],0,,0.0,unidentified
"21131No No 4000 Yes No 5Comfit Composite Knit Ltd. Unit-3Vannara Road, Po-Purbo Mouchak, Ps-",,Accord 2014,2025-09-22T21:15:11.022965,6,,23.8103,90.4125,default,very_low,[],[],0,,0.0,unidentified
"Kaliakoir, Dist- GazipurGazipur Dhaka 1751 88 1912161391 114 No No 677 Yes No 2 Comfort Apparels PVT LTD. 96, Darus Salam Mirpur, Dhaka Dhaka Dhaka 1218 88 1 116 No No 700 No Yes 1 Comptex Textiles Ltd Vulta, Rupgonj Narayanganj Dhaka 1460 2 9138162 51425314151 No No 800 Yes No 2 Concept Knitting Tilargati, Sataish Bazar, Tongi Gazipur Dhaka 88 1914853340 21524 No No 1524 1250 Yes No 5 CONCEPT KNITTING LTD MASCO 1221-223 KHARTAIL SHATAISH ROAD",,Accord 2014,2025-09-22T21:15:11.023075,6,,23.8979,90.4026,exact_location,high,[],[],0,,0.0,unidentified
"GAZIPURA, TONGI, GAZIPURDHAKA 28914130 No No No No 1 CONCEPT KNITTING LTD MASCO 2TILARGATI, SATAISH BAZAR, TONGI,",,Accord 2014,2025-09-22T21:15:11.023110,6,,23.8103,90.4125,default,very_low,[],[],0,,0.0,unidentified
"GAZIPUR. BANGLADESH.DHAKA 28914130 No No No Yes 1 Concord Fashion Export Ltd. South Shalna, Joydebpur, Gazipur, Dhaka Gazipur Dhaka 1703 88 1678024126 115 No Yes 10,1,2,4 870 No Yes 2 Concorde Garments LimitedPlot M3, Road5, Section-7, Mirpur, Dhaka Dhaka 1216 1 8052205 21523 No No 1660 Yes No 5 Confidence Knitwear Ltd. Dhanua, Nayanpur, Sreepur, Gazipur Gazipur Dhaka 2 7176036 No No Yes No 2 Consumer Knitex Limited CMT Dhamsur,Bhaluka,Mymensingh Mymensingh Dhaka 2204 88 1833322488 No No 1630 No Yes 4 CONTINENTAL APPARELS LIMITED145, Monipuri Para,Airport Road Super","Market,Tejgaon, Dhaka.DHAKA Dhaka 1215 2 8114834 16 Yes No 13,4,5,6 1150 No Yes 2",Accord 2014,2025-09-22T21:15:11.023180,6,,23.8223,90.3654,exact_location,high,[],[],0,,0.0,unidentified
"ZONESOUTH HALISHAHAR, CHITTAGONGChittagong Chittagong 88 1759920794 114 No Yes 12 201 Yes No 1Cordial Design LTD 252 Shah Ali Bag, Mirpur-01, Dhaka - 1216 Dhaka Dhaka 1216 2 8057340 No No No Yes 2 Cortz Apparels Ltd 1- Nawjor Nawjor, Kadda Bazar Dhaka 2 8852646 116 No No 1300 Yes No 1 CORTZ APPARELS LTD UNIT 1 Banirchala, sreepur Gazipur Dhaka 1208 730010409 112 No No 569 No No 1 CORTZ APPARELS LTD UNIT 2 Hakim master complex, Newjor, kadda Gazipur Dhaka 1208 714099432 117 No No 1408 No No 1 Cortz Apparels Ltd. Baniarchala, Bagher Bazar, Mirzapur Gazipur Dhaka 2 9897529 21222 No No 1310 Yes No 3 Cosmopolitan Industries PVT Ltd Epic Khejurbagan, Baro Ashulia, Ashulia Dhaka Dhaka 2 8054697 415233242 No No 5071 Yes No 6 COSMOS SWEATERS LTD. DHAKA ROAD, CHANDANA, CHOWRASTA Gazipur Dhaka 1702 2 92570513 3112131 No No 2300 Yes No 2 Cotton Clothing Satais, Gazipura, Tongi, 1700, Gazipur Gazipur 1700 98151304 6 116 No No 738 No Yes 1 Cotton Clout BD Ltd Jarun South, Kashimpur, Gazipur. Gazipur Dhaka 1700 1712527117 7 112 No No 12 816 Yes No 8 cotton club bd ltd. Jorun South, Kashimpur Gazipur 1712527117 No No Yes No 1 Cotton Dyeing  Finishing Mills Ltd.Vill Amtoli Union, 10 No. Habirbari PO","Seed Store Bazzar Thana Valuka, Mymensingh Dhaka 2240 88 8827502 912 22 39 No Yes11,2 22 31,6- 93200 Yes No 5 Cotton Field BD LimitedShima Complex, Plot  23,Shataish Road,",Accord 2014,2025-09-22T21:15:11.132852,7,,24.0234,90.3912,exact_location,high,[],[],0,,0.0,unidentified
"GazipuraGazipur Dhaka 2 7788982 118 No Yes 180,1,2,3,4 1465 No Yes 3 Cotton Harvest LTD 1Dhaka Dhaka 1705 88 9291558 1 No No 1360 Yes No 1 Cotton Power Excel Knit. Ltd.Sayed M Hossain Road, Police Line West","Isdire, Fatullah, 1400, Narayanganj, BD2 7632224 No No No No 1 Crazy Fashions LimitedC.E. Tower 15th  16th floors plot-I, Block- E, Avenue-1, Kalsi Road, Mirpur-11Dhaka Dhaka 1216 88 9127421 1119 No Yes 116, 15, 14, 13 650 Yes No 2 CREATIVE SWETERS PVT LTD. UNIT -2IA , SHILPA PLOT, DARUS SALAM ROAD,",Accord 2014,2025-09-22T21:15:11.133032,7,,23.8223,90.3654,exact_location,high,"['Esprit', 'PVH']","[1.0, 1.0]",2,Esprit,1.0,other_brands
"MIRPUR-1, DHAKA-1216Dhaka Dhaka 1216 2 9003711 107 119 No No 12,3,4,5,6,7,8,9 1350 Yes No 2 Creative Woolwear 3B Darus Salam Road Dhaka Dhaka 88 172231862 21522 No No 1522 954 No Yes 5 CRESCENT FASHION AND DESIGN LIMITED Beximco Industrial Park, Sarabo, Kashimpur Gazipur Dhaka 2 8618220 415213141 No No 4900 No Yes 5 Crony Tex Sweater Ltd.Plot No. 190-193, 206-209, Block B, BSCIC",,Accord 2014,2025-09-22T21:15:11.133242,7,,24.0234,90.3912,exact_location,high,['PVH'],[1.0],1,PVH,1.0,other_brands
"Industrial Estate, Fatullah, NarayangonjNarayanganj Dhaka 1400 2 8415123 114 No No 1354 No No 3 Crossline Factory Pvt Ltd. 25 Vadam, Uttar Para, Tongi, Gazipur Tongi 1711 98152569 9 18 No No 1200 No No 7 CROSSLINE KNIT FABRICS LTD.3C , VADAM , NISHAT NAGAR , TONGI ,",,Accord 2014,2025-09-22T21:15:11.133319,7,,23.8103,90.4125,default,very_low,[],[],0,,0.0,unidentified
"GAZIPURGazipur Dhaka 1711 2 9815257 21727 No No 3000 Yes No 2 Crossline Woven Garments Ltd. unit 1House 01, Road 02, Section 07,",,Accord 2014,2025-09-22T21:15:11.133361,7,,23.8103,90.4125,default,very_low,[],[],0,,0.0,unidentified
"Industrial Area, Pallabi, MirpurDhaka Dhaka 88 1 116 Yes Yes 13,5,6 690 No Yes 1 Crossline Woven Garments Ltd. unit 2House 16, Road 13, Section 11 12, Pallabi,",,Accord 2014,2025-09-22T21:15:11.133409,7,,23.8223,90.3654,exact_location,high,[],[],0,,0.0,unidentified
"Mirpur, DhakaDhaka Dhaka 1216 88 1 118 Yes No 16,7,8 450 No Yes 1 Crosswear Industries Ltd.Durgapur, Kathgora Bazar, PO Zirabo,",,Accord 2014,2025-09-22T21:15:11.133450,7,,23.8223,90.3654,exact_location,high,['Gap'],[1.0],1,Gap,1.0,other_brands
"Ashulia, Dhaka-1341Dhaka 1341 88 9008331 16, No No 16, 990 Yes No 3 Crown Fashion  Sweater Ind. Ltd.Crown Plaza , Plot No. 781  782, Vogra,","Joydevpur, GazipurGazipur Dhaka 1704 2 9252574 21728 No Yes10,1,2,3,4,5,62",Accord 2014,2025-09-22T21:15:11.133515,7,,24.013114927972843,90.38738110973782,area_match,medium,[],[],0,,0.0,unidentified
"0,1,2,4,5,6,74618 No No 12Crown Knitwear Ltd Plot 781-782, Vogra, Joydebpur, Gazipur Gazipur Dhaka 1702 1 1 No No 1500 No Yes 4 Crown Wears Pvt. Ltd.Jamirda, Seedstore, Habirbari, Bhaluka,","MymensinghMymensingh Dhaka 2240 2 9261233 113 No No 2150 No Yes 3 Crystal Apparels Pvt.Ka-156, Rasulbagh, Mohakhali, Ka-156,",Accord 2014,2025-09-22T21:15:11.133599,7,,23.8103,90.4125,district,low,['H&M'],[1.0],1,H&M,1.0,premium_fast_fashion
"Rasulbagh, Mohakhali, DhakaMohakhali 1212 88 8827276 118 Yes Yes 13,8 461 Yes No 1 Crystal Composite Ltd Khajur Bagan, Ashulia Ashulia Dhaka 1341 88 9012979 21116 No No 500 No No 5 Crystal Industrial Bangladesh Sa Plot 2013 Kewa Sreepur Gazipur. GAZIPUR 2 29261683 12 No No 1255 Yes No 1 Crystal Martin Apparel Bangladesh Limited203, Habirbari, Seedstore, Valuka,",,Accord 2014,2025-09-22T21:15:11.133732,7,,24.2198,90.4125,exact_location,high,['Walmart'],[0.88],1,Walmart,0.88,mass_market
"MymensinghMymensingh Dhaka 88 1678031198 111 No No 1183 Yes No 1 CUTTING EDGE INDUSTRIES LTD. 1612, Dakhin Salna, Salna Bazar, Sadar Gazipur Dhaka 2 9205131 3162331 No No 2700 Yes No 5 DS PRETTY FASHIONS LTDPretty Square, South Salna, Joybedpur,",,Accord 2014,2025-09-22T21:15:11.133794,7,,23.8103,90.4125,default,very_low,['H&M'],[1.0],1,H&M,1.0,premium_fast_fashion
"GazipurGazipur Dhaka 1740 2 920444951 51621314151 No No 3000 Yes No 2 D.S. Fashion Ltd.Mamun Nagar, Bara Vabanipur, Kashimpur,",,Accord 2014,2025-09-22T21:15:11.133836,7,,23.8103,90.4125,default,very_low,[],[],0,,0.0,unidentified
"GazipurGazipur Dhaka 1346 88 8414697 414 No No 482 No Yes 3 DADA DHAKA LTD.Holding  40, Joymot Khan Road, Pagar,","Munnu Nagar, Tongi, Gazipur-1710,",Accord 2014,2025-09-22T21:15:11.133873,7,,24.021482245073322,90.38062251623941,area_match,medium,[],[],0,,0.0,unidentified
"Bangladesh.Dhaka Dhaka 1230 114 No No 2362 No No 4Daeyu Bangladesh LTD 731, Bhannara Mouchak 2 9298001 2 No No No Yes 2 DAL KNITWEAR LTD.Plot - 12 , Dr.M.A.Rashid Road , Aouch Para",,Accord 2014,2025-09-22T21:15:11.133936,7,,23.8103,90.4125,default,very_low,[],[],0,,0.0,unidentified
"South  , Tongi , Gazipur ,1 114 No No 14 450 Yes No 1 Dana Sweater Industries Ltd Soildubi, Kashimpur, Gazipur, Dhaka Gazipur Dhaka 1346 2 8618220 7 10122232425161",,Accord 2014,2025-09-22T21:15:11.133993,7,,23.8103,90.4125,default,very_low,[],[],0,,0.0,unidentified
"718191101No No 2150 Yes No 6 Danier FashionS Ltd Zirabo, Ashulia , Savar, Dhaka Dhaka Dhaka 29564281 2 No No 350 Yes No 1 Day Apparels Ltd. 1351 Sultan Chawk Market Chittagong Chittagong 31 1911672614 19 No No Yes No 2 Day Fashions Ltd. 1351 Sultan Chawk Market, Aturar Depot Chittagong Chittagong 31 728487 19 No No No Yes 1 DAZZLING DRESSES LIMITED5152, ISMAIL PLAZA, SHAH KABIR MAZAR","ROADDHAKA Dhaka 1230 2 9006747 16 No No 13,4,5 800 Yes No 1 DEBONAIR GROUPGirat,Sarker market road,Ashulia,Dhaka-Ashulia Dhaka 88 1939906503 13, No No 2600 No Yes 1 Debonair LimitedGorat, Sarker market Road, Ashulia, Savar,",Accord 2014,2025-09-22T21:15:11.134076,7,,23.882050034061187,90.19831381540942,area_match,medium,[],[],0,,0.0,unidentified
"DhakaDhaka Dhaka 1341 88 7790844 113 No No 1600 No Yes 10 Debonair Limited Unit-2Plot  356, Shorifpur, Ozarpara, National",,Accord 2014,2025-09-22T21:15:11.134186,7,,23.8103,90.4125,default,very_low,[],[],0,,0.0,unidentified
"University, JoydebpurGazipur Dhaka 88 1938898978 21321 No No 780 Yes No 3 DEKKO APPARELS Ashulia unit 62, Kathgora, Amtola, Ashulia, Savar, Dhaka Dhaka Dhaka 1341 2 7792867 15 No No 3100 No Yes 1 Dekko Apparels Ltd. M4, road 7, section 7 mirpur, Dhaka Dhaka Dhaka 1711531207 117 No No 1631 No Yes 7 Dekko Designs Ltd Purba Naroshinhapur, Ashulia, Savar, Dhaka Dhaka Dhaka 1711531207 416223211 No No 4132 No Yes 7 Dekko Fashions LtdPlot  M4, Road  7, Section  7, Mirpur,","DhakaDhaka Dhaka 1216 1 2369004398 117 No No 14, 1100 No Yes 2",Accord 2014,2025-09-22T21:15:11.134306,7,,23.8223,90.3654,exact_location,high,[],[],0,,0.0,unidentified
"DEKKO KNITWEARS LTD. UNIT - 2Plot  M  2 - 1, Road  7, Section  7,",,Accord 2014,2025-09-22T21:15:11.222479,8,,23.8103,90.4125,default,very_low,[],[],0,,0.0,unidentified
"Mirpur I  ADhaka Dhaka 1216 2 9006747 18 No No 14,5,6,7,8 469 Yes No 1 Dekko Ready Wear Ltd.Plot  M1, Road  7, Section  7, Mirpur,",,Accord 2014,2025-09-22T21:15:11.222553,8,,23.8223,90.3654,exact_location,high,[],[],0,,0.0,unidentified
"DhakaDhaka Dhaka 1216 2 9132934 1110 Yes Yes 17, 2850 Yes No 4 Delicate Garments LTD. Rajaghat, Rajfulbaria, Savar, Dhaka Dhaka Dhaka 2 8153681 No No No Yes 3 Delicate Knitwears Limited Rajaghat, Rajfulbaria Savar Dhaka Dhaka Dhaka 1207 0 888417478 117 No No 543 No No 1 DELMAS APPARELS pvt LIMITED PLOT 05, SECTOR 2A, ROAD 1, CEPZ Chittagong Chittagong 4214 31 740974 103 15 No No 1250 No Yes 2 Deluxe Apparels Ltd. 14ka, Ring Road,Shyamoli DHAKA Dhaka Dhaka 1207 1 1 No No No No 1 DELUXE FASHIONS LTD.178179 BAIZID BOSTAMI ROAD, P.S.","BAIZID,CHITTAGONG 4210 31 684413 618253648 No No11, 2, 3, 4, 5, 6",Accord 2014,2025-09-22T21:15:11.222680,8,,22.25,91.8,exact_location,high,['C&A'],[1.0],1,C&A,1.0,value_fast_fashion
"SHED212478 No Yes 1Denier Fashion Ziraboo, ashulia Dhaka 1340 88 1 No No No Yes 1 DENIM ATTIRES LIMITEDNimtaly, Shilmon, Tongi, Gazipur, Gazipur 88 1 No No No Yes 1 Denim Expert LimitedPlot 96-100, Sector 3, Kepz, North Chittagong Chittagong 2 8052340 3132131 No No 1500 Yes No 4 Denim Plus  BD  Ltd.Plot 3-8, Sector 7, CEPZ, Chittagong,",,Accord 2014,2025-09-22T21:15:11.222840,8,,23.8103,90.4125,default,very_low,[],[],0,,0.0,unidentified
"Bangladesh, Chittagong Export Processing","ZoneChittagong Chittagong 0 8054697 414213141 No No 1650 Yes No 4DenimachKewa Mouja, Ward No. 5, Gorgoria",Accord 2014,2025-09-22T21:15:11.222858,8,,22.253371022826634,91.80270577462139,area_match,medium,[],[],0,,0.0,unidentified
"Masterbari, SreepDhaka Dhaka 88 1713031432 3172332 No No 17 6300 Yes No 3 DESH GARMENTS LIMITED 53A KALURGHAT HEAVY INDUSTRIAL AREA CHITTAGONG 88 670020 112 No No 1G, 1 850 No No 1 Desh Garments Ltd. B-40, BSCIC Industrial Estate, Gazipur Dhaka 2 9816667 116 No No 1340 Yes No 1 Design Destination limitedSayed M hossain Road , west Isdire",,Accord 2014,2025-09-22T21:15:11.222977,8,,24.0167,90.4167,exact_location,high,[],[],0,,0.0,unidentified
"Tagarpar , FatullahNarayangonj Dhaka 1400 88 7645817 106 18 No No 330 No No 1 Designer Jeans Ltd. 87 Beron, P. O. Ashulia, Thana Savar Dhaka 2 7790783 13 No No No No 5 DESIGNTEXNorth tower, Plot 107, Sector 7, Uttara,",,Accord 2014,2025-09-22T21:15:11.223036,8,,23.8759,90.3795,exact_location,high,[],[],0,,0.0,unidentified
"BangladeshDhaka Dhaka 1230 2 8932034 117 No Yes 2650 No No 1 Designtex Fashions Ltd. Zirabo, Ashulia, Savar, Dhaka Dhaka Dhaka 1341 2 7708996 Yes No 12,3,4,5 1350 Yes No 1 Designtex Sweater Ltd. 255, Konabbari, Gazipur Gazipur Dhaka 1711523665 216 No No 2367 Yes No 4 Desun Garments Ltd. 891,Birulia Road,Savar, Dhaka Dhaka Dhaka 1340 88 7743668 114 No No 450 No Yes 2 Dewan Fashion Wears Ltd. Navana village, ashulia, savar 2 1713013368101112131415",,Accord 2014,2025-09-22T21:15:11.223130,8,,23.8103,90.4125,default,very_low,[],[],0,,0.0,unidentified
