factory_name,address,source,extraction_date,page_number,worker_count,latitude,longitude,geocoding_method,geocoding_confidence,identified_brands,brand_confidence,num_brands,primary_brand,max_confidence,brand_tier
"eastate Kalurghat ChittagongChittagong Chittagong 31 2570701 2 115 No No 2100 Yes No 5 Smart Knitwear Ltd.House  105, Road  5, Block  A, Section ",,Accord 2014,2025-09-22T21:15:13.495376,27,,22.3712,91.8934,exact_location,high,['PVH'],[1.0],1,PVH,1.0,other_brands
"12, Pallabi, Mirpur, DhakaDhaka Dhaka 1216 No No No No 1 Smee Apparels Ltd. Plot 19, Road 04, Sec-07 2 9013824 No No Yes No 1 Smh New Generation Apparels Ltd 92,Dune Tower,Kodda Bazar,Joydebpur Gazipur Dhaka 1700 0 889257553 116 No No 1103 Yes No 5 Smug Sweater LtdTalepara, Chandona, Chowrasta, Joydevpur.",,Accord 2014,2025-09-22T21:15:13.495446,27,,23.9989,90.4203,exact_location,high,[],[],0,,0.0,unidentified
"GazipurGazipur Dhaka 1702 2 9264079 117 No No 1536 No No 5 SNV Stitches Ltd. Plot No. 558 SatarKul, Uttor Badda Dahka 1212 2 1711592063 11 No No 11 85No Yes 1 So Nice Garments Pvt Limited G.P.GA 185A Mohakhali Gulshan Dhaka Dhaka 1212 88 1973036930 No No No No 1 SOFTEX COTTON UNIT 1Hazi Kuzrat Ali Mollah Super Market, 1N,","Harunabad Pallabi, Mirpur12, DhakaDhaka Dhaka 1216 2 909802 118 Yes Yes 11, 3, 4, 7 1700 No Yes 2 SOFTEX COTTON UNIT 2Hazi Kuzrat Ali Mollah Super Market, 1N, Harunabad Pallabi, Mirpur12, DhakaDhaka Dhaka 1216 2 909802 1 Yes Yes 15, 6, 7 1700 No Yes 1 Softex Sweaters Dhaka EPZ Extension Area, Ganakbari, Dhaka Dhaka 1349 2 8814816 113 No No All 1491 No No 2 SONIA FINE KNIT LTDKONDOLBAGH, TAIBPUR, ASHULIA ROAD,",Accord 2014,2025-09-22T21:15:13.495518,27,,23.8463,90.2673,exact_location,high,['Uniqlo'],[1.0],1,Uniqlo,1.0,premium_fast_fashion
"SAVAR, DHAKASAVAR Dhaka 88 1714114034 13 No Yes 11,2 1200 No Yes 1 Sonia Sweaters Ltd.604 Kondolbagh Taibpur, Ashulia Road, DHAKA Dhaka 2 9289388 211121 No No 2556 Yes No 8 Soorty Textiles BD Ltd. 1Comilla 3500 1 713109028 No No Yes No 1 Sourov Hosiery West Isdair, Police Line, Fatullah Narayanganj Dhaka 1400 88 1819187774 No No 200 Yes No 2 Sourthen Clothing Limited Bottola, Zirabo, Ashulia, Dhaka Dhaka Dhaka 1341 88 1 115 No No 464 No Yes 2 South East Textile Interstoff Apparels Ltd Gorai, Mirzapur Tangail Dhaka 2 8924030 8172331425261",,Accord 2014,2025-09-22T21:15:13.495786,27,,23.6167,90.5333,exact_location,high,[],[],0,,0.0,unidentified
7181No No 2500 Yes No 5 Southend Sweater Co Ltd Dhour Beribadh - Ashulia - Turag - Gazipur Dhaka Dhaka 1230 2 8808923220 114 No No 1050 No Yes 1 SOUTHERN CLOTHINGS LTD  SOUTHERN,,Accord 2014,2025-09-22T21:15:13.495836,27,,23.8103,90.4125,default,very_low,[],[],0,,0.0,unidentified
"POSHAK SHILPA LTDZirobo, Ashulia Dhaka Dhaka 1341 88 1 415223141 No No 1103 Yes No 1 SOUTHERN DESIGNERS LIMITED JIRABO, ASHULIA, SAVAR DHAKA 88 89200823 41322 No No 927 No No 3 Southern Garments Ltd Zirabo, Ashulia, Savar, Dhaka Dhaka Dhaka 1341 88 7792449 111 No No 859 No No 4 Southern Knitwear Ltd.HIZOLHATI, BAROIPARA KALIAKOIR,",,Accord 2014,2025-09-22T21:15:13.495918,27,,23.8103,90.4125,default,very_low,[],[],0,,0.0,unidentified
"GAZIPUR-1700Gazipur Dhaka 1750 2 8413930 115 No No 1280 No No 3 Southern Services Ltd Plot 6, Road 2, Sector 3 Dhaka 88 2247 115 No No 575 No No 1 Space Sweater Limited Parijat, Konabari, Gazipur Gazipur Dhaka 1700 2 9298880 117 Yes Yes 17, 700 Yes No 4 Sparrow Apparels Ltd., Chandona, Laxmipura, Gazipur Gazipur Dhaka 0 426357810 21522 No No 3876 No No 4 SPECIALISED TEXTILE  CHITTAGONG","FASHION GROUPPlot  26, Road  4, Sector  1, CEPZ. Chittagong Chittagong 88 1911329999 17 No No 1235 No Yes 4 Spectra Sweater Ltd312 Himardighi, Monnu Nagar, Tongi,",Accord 2014,2025-09-22T21:15:13.496010,27,,23.895863169089605,90.40104794497036,area_match,medium,[],[],0,,0.0,unidentified
"GazipurGazipur Dhaka 1712 2 816296 117 Yes Yes 16, 950 Yes No 5 SPEKS LIMITED 754827, MEHIDIBAGH ROAD, CHITTAGONG 1919396539 114 Yes Yes 1G,3,4. 376 Yes No 1 Spencer Design LtdS-21 Apparels Ltd, Plot-276, Narshinghapur,",,Accord 2014,2025-09-22T21:15:13.496121,27,,23.8103,90.4125,default,very_low,[],[],0,,0.0,unidentified
"Ashulia, Savar, DhakaDhaka Dhaka 1234 2 7788492 11124 No No 11 21,2,3, 800 No No 1 Spotfame Apparels Ltd.Chamudda, Mirar Bazar, Pubail, Gazipur Gazipur Dhaka 2 1711680834 No No No Yes 1 SPRING TRADE LTD.Konapara, Plot 42,Zirani Bazar, B.K.S.P, Dhaka Dhaka 1340 2 7788087 415263141 No No 2000 Yes No 4 SQ BIRICHINA Beraiderchala, Keowa, Maona, Sreepur Gazipur Dhaka 1 No No No No 1 SQ Birichina Ltd Jamirdia, Valuka Mymensingh Dhaka 2240 2 98501815 6162631465161 No No 4800 Yes No 6 SQ Celsius Limited Beraiderchala, Keowa, Maona, Sreepur Gazipur Dhaka 1740 88 1713370890 413233141 No No 4900 Yes No 5 SQ Celsius LtdBeraiderchala, Keowa, Maona,Sreepur,",,Accord 2014,2025-09-22T21:15:13.496262,27,,24.2198,90.4125,exact_location,high,[],[],0,,0.0,unidentified
"GazipurGazipur 2 1162762276 14 No No 2284 Yes No 2 SQ Celsius Ltd.Auto Jamirdia, Valuka, Mymensingh Mymonshingh 2250 98501815 115 No No 500 No Yes 2 SQUARE FASHIONS LTDROKEYAPUR, JAMIRDIA, HABIR BARI,",VALUKAMymensingh Dhaka 2240 88 1711315779 13112334445165,Accord 2014,2025-09-22T21:15:13.496313,27,,23.8103,90.4125,district,low,[],[],0,,0.0,unidentified
"25132No No 7000 Yes No 11Square Fashions Ltd - Unit 2 Chandana, Basan Union, Gazipur Gazipur Dhaka 1712 1730728217 115 No No 2400 No No 4 SRT Fashions Ltd. Industrial Plot, M 44, Section 14, Dhaka Dhaka Dhaka 1216 1 No No No No 2 SS Sweater Ltd 124 Darailkl Sataish Tongi Tongi, Gazipur Dhaka 1712 88 1713044910 2 No Yes 850 No No 1 SSB Knitwear Ltd. A53 BSCIC IE, Fatullah NARAYANGANJ Dhaka 1400 88 27670297 No No No No 1 STANDARD STITCHES LTD WOVEN UNITFF TOWER, BAIMAIL, KONABARI, GAZIPUR",,Accord 2014,2025-09-22T21:15:13.496462,27,,23.6167,90.5333,exact_location,high,[],[],0,,0.0,unidentified
"SADAR, BNAGLADESH1346 2 8057052 No No No No 2 Star Garments Pvt Ltd  Sha-23, Middle Badda Dhaka Dhaka 1212 2 9814200 6 115 No No 797 Yes No 3 Starlet apparel ltdRoad no. 01, Plot no. 223-224, BSCIC,","FatullahNarayangonj 88 1711040200 116 No No 1G,1,2,3 200 Yes No 2 Starlight SweatersVogra national university Gazipur Sadar, DhakaGazipur Dhaka 1711610393 1110 No No 6250 No Yes 10 StartletRoad no 1 223 224 Fatullah, Narayagonje,",Accord 2014,2025-09-22T21:15:13.496512,27,500.0,23.7805,90.4267,exact_location,high,[],[],0,,0.0,unidentified
"STERLING APPARELS LTD Beron, Earpur Union, Ashulia, Savar Dhaka Dhaka 2 77018934 5182131 No Yes 180,1,2 3300 Yes No 1 Sterling Creations Ltd Baron, Earpur Union,Ashulia, Saver Dhaka Dhaka 0 77018934 119 No No 3300 Yes No 4 Sterling Denim Ltd. Dhania, Nayarhat, Savar Dhaka Dhaka 2 77888165 3182212 No No 4800 Yes No 2 Sterling Designs LimitedWard No 7, Biswaspara, Chandara,",,Accord 2014,2025-09-22T21:15:13.583602,28,,23.8103,90.4125,default,very_low,[],[],0,,0.0,unidentified
"Kaliakoir, GazipurArea- 192,000 SqftGazipur 1752 88 82252090 16 No No 3300 No Yes 1 STERLING STYLES LTD BARON, EARPUR UNION, ASHULIA, SAVAR Dhaka Dhaka 2 8828122 117 No No 2500 Yes No 6 Stitch Right LimitedPlot B-5,BSCIC Industrial Estate,Tongi,",,Accord 2014,2025-09-22T21:15:13.583714,28,,24.0167,90.4167,exact_location,high,[],[],0,,0.0,unidentified
"GazipurGazipur Dhaka 1710 88 1811413365 117 No Yes 11,2,3,4,5,6 1125 No Yes 2 Stitchtone Apparels Ltd.1819 Strand Road, Champa Tower, Chittagong Chittagong 31 2851620 111 Yes No 16 485 No Yes 5 Stitchwell Design Ltd Extended 1 1 No No No Yes 2 Stitchwell Designs Ltd 4301A, Tejgaon 4301A, Tejgaon Industrial Area Dhaka Dhaka 1208 2 8891672 118 No No 2200 No No 1 Stylecraft Limited 11, East Chandona, Joydebpur Gazipur Dhaka 2 9257350 21511 No No 3400 Yes No 8 Stylecraft Ltd 42-44 Chandona, Joydevpur, Gazipur 2 9257349 1 No No 3400 No Yes 2 Stylo Fashion Garments LimitedNanduain, No.2 Kaultia Union, Bhawal,",,Accord 2014,2025-09-22T21:15:13.583848,28,,23.9989,90.4203,exact_location,high,[],[],0,,0.0,unidentified
"Mirzapur,Dhaka Dhaka 1207 88 28958075 11116 No No 10,1,2,3,4,5 3000 No No 1 Stylo Fashion Garments Ltd.Nanduain, No-2 Kaultia Union, Bhawal","MirzapurGazipur Dhaka 2 9205081 115 Yes Yes All 3187 No Yes 5 Styrax Fashion LimitedPlot  194, DEPZ Extn. Area Ganakbari, Savar, DhakaDhaka Dhaka 1349 88 7701140 116 No Yes 14 850 Yes No 4 SUFI APPAREL LTD75, Plot  2, D.T. Road .C.D.A . Market , Pahertali, ChittagongCHITAGONG 4202 88 2773098 13 No No 650 No Yes 2 Sumi Apparels Pvt. Ltd.A-112,113,west side,BSCIC,Tongi,",Accord 2014,2025-09-22T21:15:13.583898,28,,23.855139575573688,90.2633612790666,area_match,medium,[],[],0,,0.0,unidentified
"Gazipur,Bangladesh.Gazipur Dhaka 1710 88 9817815 115 No No 1510 Yes No 5 Summer Dress Ltd.Jangaliapara, Vawal Mirzapur, Gazipur",,Accord 2014,2025-09-22T21:15:13.584089,28,,23.8103,90.4125,default,very_low,[],[],0,,0.0,unidentified
"Sadar, GazipurGazipur Dhaka 1700 9803200 111 No No 11 800 No Yes 1 Sun Cherry Body Fashions Mfty Ltd. Ward 7, Holding E-44, Chandra, Kaliakoir Dhaka Dhaka 0 682252144 415213141 No No 850 Yes No 4 Sun Washing Plant8 no. Panwala Para, North Agrabad,","Chittagong, Bangladesh88 1927879133 No No No Yes 1 SUNDRY WEARS LTD212,NASIRABAD INDUSTRIAL AREA,BAIZED",Accord 2014,2025-09-22T21:15:13.584163,28,,22.249270508807673,91.79981585854429,area_match,medium,[],[],0,,0.0,unidentified
"BOSTAMI ROAD, CHITTAGONGCHITAGONG 4210 88 2584069 13 Yes No 11,2,3 300 No Yes 1 Sung Kwang Sweaters Ltd.Ibrahim Tower, Plot  313,314,315, Wireless","Gate, Chandona, Gazipur, BD2 1715135565 No No No Yes 2 SungKwang Apparels LtdPlot No 1384-86 1420-21 VOGRA BASON",Accord 2014,2025-09-22T21:15:13.584248,28,,24.0134921116894,90.38825657295277,area_match,medium,[],[],0,,0.0,unidentified
"SARAK CHANDONA GAZIPURGazipur Dhaka 2 8812142 116 No No 1256 Yes No 7 Supasox Ltd. Rajashon Road, Aicha Noadda, Savar DHAKA Dhaka 1340 2 77471597743 7152734415161","road, nasirabad ia, chittagongChittagong Chittagong 31 682767 No No No No 1 SUPERSHINE APPARELS LTD11 WEST HAZAPIRA, DIT ROAD, RAMPURA , DHAKA 1219DHAKA Dhaka 1219 2 8412394 1 No No 650 No Yes 1 SUPREME KNITWEAR LTDAdamjee EPZ, Plot  6-10, Adamjee EPZ, SiddergonjNarayanganj Dhaka 1431 88 1720165150 513 23 32 41 51 No No 1000 No Yes 1 Supreme Smart Wear LtdPlot No. 1-5 Adanjee EPZ, Adamjee Nagar,",Accord 2014,2025-09-22T21:15:13.584344,28,250.0,23.6234,90.5456,exact_location,high,[],[],0,,0.0,unidentified
"NarayangonjNarayanganj 88 9854533 21212 No No 2051 Yes No 3 Supreme Stitch Ltd. WEST SHAILDUBE, KASHIMPUR Gazipur Dhaka 1704 1678038855 21323 No No 686 No No 2 Surma Garments Ltd. Aicha Noadda, Rajashon Road Savar, Dhaka Dhaka Dhaka 2 8140237 416233443 No No 1700 No No 7 Susuka Knit Ltd Yusuf Market, Yarpur, Ashulia, Dhaka Dhaka Dhaka 2 7631737 113 No No 300 No Yes 3 SWEATER ZONE LTDNaoujoor, Tangail Road, Chandana GAZIPUR Dhaka 1702 2 9262371 16 No No 1750 Yes No 1 Sweatertech Ltd. Plot  1187, 1214-1215 Gacha Road, Gazipur Gazipur Dhaka 2 9293215 21425 No No 995 Yes No 4 T.J Sweater Ltd167, Sataish Road, Gazipura, Tongi, Gazipur 88 1 No No No No 1 Taati Fashion Apparels LtdDhaka-Sylhet Highway, Narayangang,",,Accord 2014,2025-09-22T21:15:13.584677,28,,24.0234,90.3912,exact_location,high,[],[],0,,0.0,unidentified
"Rupganj DhakaRupganj Dhaka 0 7173083526 111 No No 11 1200 Yes No 1 Tafop Apparels Ltd.Block-A, Plot 1, 2, 3 part, BSCIC IA,","Sagorika RoadChittagong Chittagong 31 750325 No No No Yes 2 Tahersons Fashions Limited4700H, Haji Safi Complex, Terminal",Accord 2014,2025-09-22T21:15:13.584724,28,,22.2523200115258,91.79702423359211,area_match,medium,['PVH'],[1.0],1,PVH,1.0,other_brands
"Connecting Road, ChandgaonChittagong Chittagong 4100 88 1724963521 116 No No 450 Yes No 3 Taj Knitting Industries Ltd Kunia, Borobari, Joydebpur Gazipur 1710 1 726986799 115 No No 1579 No Yes 1 TALISMAN LTD Unit 12Plot No FS-SFB  7, DEPZ, Extension Area ,",,Accord 2014,2025-09-22T21:15:13.584834,28,,23.9989,90.4203,exact_location,high,[],[],0,,0.0,unidentified
"Ganakbari, SavarDhaka Dhaka 2 7788228 411213144 No Yes 41 3600 Yes No 7 Talisman Ltd. co FCI BD LtdPlot 7-10  13-16, DEPZEXT, Ganakbary,","Savar, DhakaDhaka Dhaka 2 7788872 11011 No No 2500 No Yes 6 Tamanna Sweater LtdMC Bazar, Mulaid, Mawna, Sreepur, Gazipur, BangladeshGazipur Dhaka 1704 2 8961086 21121 No No 1000 Yes No 2 Tamishna Fashion Wear LtdPlot  247, Bhadam, Nishatnagar, Tongi,",Accord 2014,2025-09-22T21:15:13.584883,28,,23.854991067194813,90.26567190985973,area_match,medium,[],[],0,,0.0,unidentified
"GazipurGazipur Dhaka 1711 88 8931925 26 51717151214 No No 3500 No No 4 Tamishna Fashion Wear LtdUnit-2 8 no. Mulaid, Sreepur, Gazipur Gazipur Dhaka 1740 1713013579 11 No No 620 Yes No 1 Tammam Design Ltd Zirabo, Ashulia, Savar, Dhaka Dhaka Dhaka 1341 2 7792901 18 Yes No 12 500 No Yes 1 Tanaz Fashions Ltd.216 Sataish Road, shamim Complex,","Gazipura, Tongi, GazipurGazipur Dhaka 1712 2 9814070 119 No No 15,8 1665 No Yes 4 TANDEM SWEATERS LTDChambur Khan, Moiner Tech, Uttar Khan,",Accord 2014,2025-09-22T21:15:13.585056,28,,24.021058995769728,90.38344086500508,area_match,medium,[],[],0,,0.0,unidentified
"DhakaDhaka Dhaka 1230 2 8919031 116 No No 1100 No No 2 Tangon Knitwear Ltd. 2421 Deobhog Pucca Road,",,Accord 2014,2025-09-22T21:15:13.585167,28,,23.8103,90.4125,default,very_low,['C&A'],[1.0],1,C&A,1.0,value_fast_fashion
"NarayangonjNarayanganj Dhaka 1400 2 7644683 No No 210 Yes No 1 TANİMA KNİT COMPOSİTE LTD JK GROUP 10 South Dariapur,Savar, Dhaka Dhaka Dhaka 1340 2 7745034 35 21627 No No 3350 Yes No 1 Tanzila Textile Ltd Baroypara, Ashulia, Savar, Dhaka Dhaka Dhaka 1230 2 524972 6172233 No Yes10-6 20-1 30-",,Accord 2014,2025-09-22T21:15:13.585264,28,,23.8103,90.4125,default,very_low,[],[],0,,0.0,unidentified
"11200 Yes No 5 Taqwa Fabrics Ltd. Boherachala Gilaberaeed, Kewa, Sreepur Gazipur Dhaka 1740 88 9606500434 8162131415161","7181No No 1100 Yes No 1 Tara Tex61, Naimuddin Mollah Road, Auch Para, Tongi, GazipurGazipur Dhaka 1711 1819269967 116 No No 1015 No Yes 1",Accord 2014,2025-09-22T21:15:13.585302,28,,24.2198,90.4125,exact_location,high,[],[],0,,0.0,unidentified
"Tarasima Apparels Limited Vill Golora, POKaitta, Saturia Manikgonj Dhaka 88 1619003767 51522314252 No No 5100 Yes No 8 Taratex Fashion Limited61, Naimuddin Mollah Road, North Augh","Para, Tongi GazipurGazipur Dhaka 1700 2 9815825 11126 No No11 20,1,2,3,4,5,61000 No No 8 Target Fine Wear IndustriesAlludin Chowdhury Tower, Outpara,",Accord 2014,2025-09-22T21:15:13.679898,29,,23.8979,90.4026,exact_location,high,['Target'],[1.0],1,Target,1.0,mass_market
"Chandona Chowrasta, Joydevpu, GazipurGazipur Dhaka 88 1819234719 21824 No No 1815 Yes No 5 Tasniah Fabrics Ltd. Mayapara, Kashimpur 2 1713521593 No No No Yes 3 Taufiq Sweater Ltd. West Masdair, Fatullah, Narayangonj Narayanganj Dhaka 2 7631496 1110 No No10,1,2,3,4,5,6,7,",,Accord 2014,2025-09-22T21:15:13.680099,29,,23.8103,90.4125,default,very_low,['Walmart'],[1.0],1,Walmart,1.0,mass_market
"8,9950 No Yes 3 T-Design Sweaters Ltd. Jarun, Konabari, Gazipur, Bangladesh Gazipur 1346 88 8932034 113 No Yes 16 62,3,4 1000 No No 2 TEAM APPAREL OCEAN APPARELS 2ND","UNITPLOT-2324 , SECTOR-5, ROAD 04, CEPZ,",Accord 2014,2025-09-22T21:15:13.680144,29,,23.8103,90.4125,default,very_low,[],[],0,,0.0,unidentified
"CHITTAGONGChittagong Chittagong 31 800098 10 No No 514 No Yes 1 Tean T-Shirt Fashion Ltd. 188 Jatramura,Rupgonj,Narayangonj Narayanganj Dhaka 1360 2 8396795 116 No No 450 No Yes 1 Techno Fiber Limited Afiz Complex, Chodhurybari, Vogra Gazipur Dhaka 2 9261796 No No No No 3 Teen Age Modern FashionTeen Age Modern Fashion Ltd., Aajan",,Accord 2014,2025-09-22T21:15:13.680235,29,,23.8103,90.4125,default,very_low,[],[],0,,0.0,unidentified
"Tower, Purbahati, Hemayetpur, Savar1 113 No Yes 1,1,2,3,4 600 Yes No 1 TEJGAON TEXTILES MILLS LTD.402, TEJGAON INDUSTRIAL AREA , DHAKA-","1208, BANGLADESHDHAKA 1208 88 9132536 41222 No No 12,22 750 Yes No 1 TEMAKAW FASHION LTD8081-2,Begum Rokeya Sharoni,Shewrapara,MirpurDhaka Dhaka 1216 2 8055422 17 Yes No 10,1,2,3,4,5,6 1007 No Yes 1 TEX SOLUTION CONSULTING BANGL ADESH LTDHOUSE 08 3RD FLOOR ISHA KHAN AVENUE",Accord 2014,2025-09-22T21:15:13.680278,29,,23.8223,90.3654,exact_location,high,['Uniqlo'],[1.0],1,Uniqlo,1.0,premium_fast_fashion
"SECTOR 06 UTTARA OFFICEDHAKA 1713018042 216,17 No No 17,18. 4375 Yes No 1 Texeurop BD Ltd. Vogra, Joydevpur Gazipur Dhaka 1704 2 9262163 21821 No No 3200 No Yes 4 Texstream Fashion Limited Burir Bazar Road, 115117 Baipail, Ashulia Savar Dhaka 1212 88 1855927540 No No No Yes 1 Texstream Fashion Ltd. 115117, Burir Bazar Road, Ashulia Dhaka Dhaka 1349 88 1963001612 1 No Yes 498 No Yes 1 Textil Fashions Ltd.1202 Vogra, P.O. National University, 2 9293178 No No No Yes 1 Textile Horizon 5,Bishuya Kuribari, Mirzapur Union, Gazipur Gazipur Dhaka 1703 88 1713483928 No No 400 Yes No 1 TEXTOWN LIMITED Dewan Idris road, Bara Rangamatia, Ashulia Dhaka Dhaka 1344 2 8858671 3172436 No Yes170,1,2,4,624",,Accord 2014,2025-09-22T21:15:13.680520,29,,23.8759,90.3795,exact_location,high,[],[],0,,0.0,unidentified
"0,2361,2,3,41693 Yes No 4 Texway apparel industries ltd Fazilpur 1421 NARAYANGANJ NARAYANGANJ Dhaka 1421 1 1 No No No No 1 Thanbee Print World Ltd.  Parkway",,Accord 2014,2025-09-22T21:15:13.680560,29,,23.8103,90.4125,default,very_low,[],[],0,,0.0,unidentified
"Packaging  Printing Ltd.Sardagonj, Kashimpur, Gazipur Gazipur Dhaka 2 779006067 225 111 No No 950 No No 1 Thanis Apparels LtdPlot No.SS-5East  West wing factory","buildingChittagong Chittagong 88 1713101209 13122131415161 21131No No 893 Yes No 7THATS IT KNIT 145 NARASINGHPUR, SAVAR Dhaka Dhaka 1340 88 1811484001 8112131415161",Accord 2014,2025-09-22T21:15:13.680600,29,,23.860911961384527,90.26570247320906,area_match,medium,['PVH'],[1.0],1,PVH,1.0,other_brands
"7181No No 1500 Yes No 1 Thats it Knit Ltd unit 2 59-south Panishail, Kashimpur, Gazipur Gazipur Dhaka 1700 1 1 No No 2500 No Yes 1 Thats It Knit Ltd. 59 South Panishail, Zirani Gazipur Dhaka 1700 8878639 1011213141 No No 1500 Yes No 3 Thats It Sports Wear Ltd. 147-148 East Noroshinghopur,Ashulia, Savar Dhaka Dhaka 1341 88 1819435287 1112736 No No 15000 No Yes 5 THE BOTTOM COLLECTIONS LTD.SENA KALYAN COMMERCIAL COMPLEX 6TH",,Accord 2014,2025-09-22T21:15:13.680794,29,,23.8103,90.4125,default,very_low,[],[],0,,0.0,unidentified
"FLOOR PLOT 9, BGAZIPUR 2 9801393 118. Yes Yes 12,3,4,5,6,7,8 1050 Yes No 1 The Civil Engineers 401B, Tejgaon Industrial Area, Dhaka Dhaka 2 9862003 No No No No 1 The Civil Engineers Ltd Talirchala, Mouchak, Kaliakoir, Gazipur 2 9298920 No No Yes No 1 The Cloth  FashionMadani Super Market,Hemayetpur,Savar,","DhakaDhaka Dhaka 1340 2 7741418 116 Yes Yes 12,3,4 850 No No 1 The Dacca Dyeing Garments Ltd2-New Eskaton Road, Moghbazar, Dhaka-",Accord 2014,2025-09-22T21:15:13.680878,29,,23.7639,90.3889,exact_location,high,['C&A'],[1.0],1,C&A,1.0,value_fast_fashion
"1000, BangladeshDhaka 88 1713070000 118 No No 1240 No Yes 3 The Delta Composite Industries Limited Kashimpur Dhaka 298976525 No No No Yes 1 The Delta Composite Knitting Industries Jarun, Kasimpur, Konabari Gazipur Dhaka 2 713365988 No No No Yes 15 THE FINERY LİMİTED 2-D, Darus Salam Road, Mirpur - 1, Dhaka Dhaka Dhaka 1216 2 9014515 16 No No 1200 No Yes 1 The Immaculate Textile Ltd.Purba Panchash, Islampur, Dhamrai, Dhaka,",,Accord 2014,2025-09-22T21:15:13.681050,29,,24.0167,90.3833,exact_location,high,[],[],0,,0.0,unidentified
"BangladeshDhamrai Dhaka 1350 2 1713171000 212,11,, No No 12,11, 650 No Yes 1 The Mohammadi Limited Joar Sahara Ka-76, Joar Sahara Bazar, Badda Dhaka Dhaka 1229 31 2580324 117 No No 1G45 599 Yes No 1 The New Delta Apparels Ltd. Road 1A Plot 6,8,10 Dhaka Dhaka 1207 1713037956 14 No No 540 No No 4 The Overseas ApparelsEmbridKhawaja complex, CB-2349, Dhaka",,Accord 2014,2025-09-22T21:15:13.681138,29,,23.7805,90.4267,exact_location,high,[],[],0,,0.0,unidentified
"cantonment, Dhaka-1206, Bangladesh1 115 No No 15 500 No Yes 1 The Rose Dresses Ltd. Jamgora, Diakhali, Yearpur, Savar Dhaka Dhaka 1340 2 7788545 21727 No No 5150 No Yes 4 THE ROSE GARMENTS DESIGNERS LTDN.ISLAM CENTRE,MAAZR ROAD, DAKKHIN",,Accord 2014,2025-09-22T21:15:13.681199,29,,23.8103,90.4125,default,very_low,['C&A'],[1.0],1,C&A,1.0,value_fast_fashion
"KHAN,UTTARA,DHAKA 12302 8920031 No No No No 1 The Shanin Corp 121 Hossain Uddin khan 1st Lane, Lalbag Dhaka Dhaka 2 8615318 21622 No No 1345 Yes No 4 THE SHANIN CORP.LTD.THE SHANIN CORP.LTD. 964 Shawrapara,","Rokeya Sharoni, Mirpur, Dhaka-1216",Accord 2014,2025-09-22T21:15:13.681251,29,,23.8223,90.3654,exact_location,high,[],[],0,,0.0,unidentified
"BangladeshDhaka Dhaka 1216 88 1190697138 117 No No All 1500 No Yes 1THE WELL TEX LTD MULAID, MAWNA, SREEPUR Gazipur Dhaka 1740 88 55119 51321314151 No No 2020 No Yes 3 Tiffinys Wear Limited.,Deowaliabari, Konabari, Gazipur, Gazipur Dhaka 88 9298791 116 No No 700 Yes No 3 Tillottoma Fashions LtdHortokitola, Attabah, Chandra, Gazipur-",,Accord 2014,2025-09-22T21:15:13.681348,29,,24.2198,90.4125,exact_location,high,[],[],0,,0.0,unidentified
"1750, Dhaka, BangladeshDhaka 1750 682251951 217 23 No Yes 13 21 920 No Yes 1 Time Knitwear PVT Ltd. Baraibogh, Enayxetnagar, Narayanganj, 2 7670550 No No No Yes 1 Tip Top Fashions Ltd Civil Engineers Tower Ind Dhaka 88 29127421 1120 Yes No 15,8 650 No No 2 Titas Sweater Industries Limited Kashimpur Road, Konabari, Gazipur Gazipur Dhaka 1700 2 8849235 116 No No 16, 2200 No Yes 6 TM FASHIONS LTDHazi Ismail Bhaban, Chandana, Chowrasta,","Gazipur Sadar, GazipurGazipur Dhaka 1702 2 9261158 115 No Yes 11, 2, 3, 4 1950 No Yes 5 TM TEXTILES  GARMENTS LTDKashor, Post Hobibari, Thana Bhaluka,",Accord 2014,2025-09-22T21:15:13.681452,29,151.0,24.019985859025375,90.38327848016816,area_match,medium,[],[],0,,0.0,unidentified
"21131141151No No 4009 Yes No 1TMF CLOTHING LTD.BENGAL PLAZA-05, 5TH FLOOR, 195,","JAMGORA, SHULIA ROAD, SAVAR, DHAKA,",Accord 2014,2025-09-22T21:15:13.681589,29,,23.854761616132805,90.268447874548,area_match,medium,[],[],0,,0.0,unidentified
"BANGLADESHDHAKA 88 7788747 16 No Yes 15TH No Yes 1TNZ Apparels Ltd. C2284, Bijoy Road, Mogurkhal, Gazipur Gazipur Dhaka 1704 2 8832587 116 No No 1550 Yes No 3",,Accord 2014,2025-09-22T21:15:13.681653,29,,23.8103,90.4125,default,very_low,['Uniqlo'],[1.0],1,Uniqlo,1.0,premium_fast_fashion
"GazipurGazipur Dhaka 2 8914098 114 No No 631 Yes No 2 Top Jeans Ltd. 618 Atipara,, Uttarkhan, Uttara Baghabari Dhaka 1935601098 No No No No 2 Top Style Sweater Ltd Vogra, Bashon Road, Joydevpur, Gazipur Gazipur Dhaka 1700 2 9293302 116 Yes Yes 16, 940 No Yes 4 Topaz Dresses Limitted E-6, Middle Badda, Hakim Dhaka Dhaka 1212 88 1713490041 1110 Yes Yes 14,5,6,7,8,9, 1115 No Yes 3 Topaz Garments Ltd. 240, Tejgaon IA, Dhaka Dhaka Dhaka 1208 2 79227 114 Yes Yes 14 1300 Yes No 1 Tops N Bottoms Ltd. 1Gazipur Dhaka 1710 88 1711524339 No No No No 1 Torque Fashions Ltd Shadu Para, Paragaon, Ashulia, Savar, Dhaka Dhaka Dhaka 1340 2 7913975 222 No No 650 No Yes 4 Tosrifa Industries Ltd.Holding 42 A, Gopalpur, Monnunagar,","Tongi, GazipurGazipur Dhaka 1710 2 9817461 8172231415161",Accord 2014,2025-09-22T21:15:13.866788,30,,23.8759,90.3795,exact_location,high,[],[],0,,0.0,unidentified
"20,11100 No Yes 8 Total Fashion Ltd. Kamtal, Barpara, Bandar, Narayangonj Narayanganj Dhaka 2 8954995 No No No No 1 Toyo Composite Knit Garments 1, South Kamalapur Sarder Complex, Dhaka Dhaka Dhaka 1000 2 9333629 16 Yes Yes 11,2,3,4,5 700 No No 4 TROPICA GARMENTS LTD 63 Mohakhali CA, Dhaka Dhaka Dhaka 1212 2 8881330 No No No Yes 1 Trouser Line Ltd. Etkhola,Ghoshbagh,Toyobpur, Ashulia,Savar Dhaka Dhaka 1341 88 1819435287 114 No No 1500 Yes No 5 Trouser World PVT LTD.640, Kunia Targach, P.O- National ,","University, P.S. JoydebpurGazipur Dhaka 2 9293664 No No Yes No 6 TRUST TROUSERNO-3, SUJAT NAGAR,SULTAN MANSION,",Accord 2014,2025-09-22T21:15:13.866964,30,,24.01506887051615,90.38357621868919,area_match,medium,['C&A'],[1.0],1,C&A,1.0,value_fast_fashion
"MIRPUR-12, DHAKADhaka Dhaka 1216 2 9008091 18 Yes Yes 15,6,7,8 1500 Yes No 2 TRZ GARMENTS INDUSTRY LTD. Gacha Road, Gacha Gazipur Dhaka 2 8918481 21511 No No 3350 Yes No 8 T-SHIRT FASHION LTD 313-316,BSCIC,IA,FATULLAH NARAYANGANJ 88 7872733 1 No Yes 40,1 350 No No 2 TTS MANUFACTURING LTDDilan Complex, Dhaka Road, Chandona",,Accord 2014,2025-09-22T21:15:13.867083,30,,23.6167,90.5333,exact_location,high,[],[],0,,0.0,unidentified
"Chowrasta, Gazipur 1702Gazipur Dhaka 1702 2 769256126 117 Yes Yes 14, 850 No Yes 4 Tuba Garments Ltd.Plot  1682, Ananda Nagar, Merul Badda,","Badda, DhakaDhaka Dhaka 2 8860023 111 No No 11 870 No Yes 1 Tulagaon Fashions LtdCivil Engineers City, 7Th East  8Th West Side,Konabari, Gazipur Sadar, Gazipur-",Accord 2014,2025-09-22T21:15:13.867127,30,,23.7805,90.4267,exact_location,high,[],[],0,,0.0,unidentified
"1346, BangladeshDHAKA 2 159212222 12 No No 4800 No Yes 1TULIP GARMENTS LTD  CONCORD GROUP Ashulia , Zerabo, Kathgora Bazar,Dhaka DHAKA Dhaka 1205 2 8612927 17, Yes No 14,5,6,7 700 No Yes 1 Tung Hai Knitting  Dyeing Ltd Shibrampur BKSP, Joydebpur, Gazipur Gazipur Dhaka 2 7670713 15 9182232415161","718191No No 2220 Yes No 2 Tung Hai Sweaters Limited302 Darus Salam Road, Industrial Plot No. 2C1-B, MirpurDhaka Dhaka 1216 2 9007175 31112131 No No 1636 Yes No 3 TUNIC FASHION LTDPlot No.M2, Main Road No. 1, Section 14,",Accord 2014,2025-09-22T21:15:13.867276,30,,23.8223,90.3654,exact_location,high,[],[],0,,0.0,unidentified
"MirpurDhaka Dhaka 2 8918111 119 No Yes 14,5,6,7,8 1300 No Yes 1 Turag Garments Hosiery Mills LtdSouth Panishail, Zirani Bazar Kashimpur,",,Accord 2014,2025-09-22T21:15:13.867407,30,,23.8223,90.3654,exact_location,high,[],[],0,,0.0,unidentified
