factory_name,address,source,extraction_date,page_number,worker_count,latitude,longitude,geocoding_method,geocoding_confidence,identified_brands,brand_confidence,num_brands,primary_brand,max_confidence,brand_tier
"Mifkif Apparel Ltd. 67, Khilgaon, Chowdhurypara, DIT Road,","Ram puraDHAKA Dhaka 2 1715269747 No No 1 MILLENNIUM TEXTILES  SOUTHERN  LTD Bara Rangamatia, Zirabo, Ashulia , Savar DHAKA Dhaka 2 7791790 5 15 22 31 41 51 No No 800 5",Accord 2013,2025-09-22T21:15:09.030727,19,,23.7489,90.4234,exact_location,high,[],[],0,,0.0,unidentified
"MIM Design Ltd Basan Sarok Bazar, Vogra Gazipur, Dhaka Gazipur Dhaka 1676718757 2 1721 No No 3100 7",,Accord 2013,2025-09-22T21:15:09.030844,19,,23.8103,90.4125,default,very_low,[],[],0,,0.0,unidentified
"MIM Dresses Ltd Baishakhi Super Market, 4th Floor, Plot no.","10,11,19  21, Kalwala para, Mirpur 1,DHAKA Dhaka 1216 2 8055426 1 16 Yes No 162,3,4,5 462 2",Accord 2013,2025-09-22T21:15:09.030865,19,,23.8223,90.3654,exact_location,high,[],[],0,,0.0,unidentified
"MIM Sweater Ltd Bashan Sarak Bazar, Vogra, Gazipur Gazipur Dhaka 1704 1676718757 2 17, 25 No Yes 1422 1200 3",,Accord 2013,2025-09-22T21:15:09.030946,19,,23.8103,90.4125,default,very_low,[],[],0,,0.0,unidentified
"Minimax Ltd. Plot  33, 35, 3739, Gacha, National University,","Gazipur, DhakaGazipur Dhaka 1704 2 9291513 1 12 No No 12 2",Accord 2013,2025-09-22T21:15:09.030968,19,,24.017690142597218,90.38089176970529,area_match,medium,[],[],0,,0.0,unidentified
"MIRABELLA DRESSES LTD. Plot  M  2  1, Road  7, Section  7, Mirpur I ",ADHAKA Dhaka 1216 2 9006747 240 4 No No 408 1,Accord 2013,2025-09-22T21:15:09.031033,19,,23.8223,90.3654,exact_location,high,[],[],0,,0.0,unidentified
"Misami Garments Ltd 8223 BEGUM ROKEYA SHARANI, SHEWRAPARA,",MIRPURDHAKA Dhaka 2 8053418 1 19 No No 1200 4,Accord 2013,2025-09-22T21:15:09.031080,19,,23.8223,90.3654,exact_location,high,['Uniqlo'],[1.0],1,Uniqlo,1.0,premium_fast_fashion
"Mission Fashion Surabari, Kashimpur, Gazipur 1346Bangladesh. Gazipur Dhaka 1346 8950081 2 1 No No 22 450 1",,Accord 2013,2025-09-22T21:15:09.031148,19,,23.8103,90.4125,default,very_low,[],[],0,,0.0,unidentified
Mitali Fashions Ltd.,,Accord 2013,2025-09-22T21:15:09.031163,19,,23.8103,90.4125,default,very_low,[],[],0,,0.0,unidentified
"Mitali Apparels Ltd.Hatimara Road, Barenda, Kashimpur, Gazipur Gazipur Dhaka 2 9297771 4 16 24 36 41 No Yes 14 20,1,2,3","30,1,2,3,4,5 401800 3",Accord 2013,2025-09-22T21:15:09.031207,19,,23.8103,90.4125,default,very_low,[],[],0,,0.0,unidentified
"MK APPARELS LTD MATSUOKA APPARELS PLOT 60, ROAD7,WARD4,BLOCK4,","Kumkumar y, Ashulia , Savar , Dhaka.DHAKA 1341 1730071333 2 16, No No Not Shared 2000 1",Accord 2013,2025-09-22T21:15:09.031256,19,,23.88709966548595,90.19882453196496,area_match,medium,['PVH'],[1.0],1,PVH,1.0,other_brands
"MK Fashion Ltd. Zirabo, Ashulia, Dhaka, Bangladesh 2 171593618 No No 1","MM Knit Wear Ambagh Road, Konabari, Nilnagar Gazipur Dhaka No No 1",Accord 2013,2025-09-22T21:15:09.031317,19,,24.01672411325305,90.38685601224105,area_match,medium,[],[],0,,0.0,unidentified
"Modele De Capital Ind Ltd Talla Road, Khapur Fatullah, Narayangonj Narayanganj Dhaka 2 7452133 202 8 17 23 32 41 51 61",71 81No No  2688 3,Accord 2013,2025-09-22T21:15:09.031393,19,,23.8103,90.4125,default,very_low,['C&A'],[1.0],1,C&A,1.0,value_fast_fashion
"MODISTE CEPZ LTD Plot No  3336, Sector  07, Export Processing",ZoneCHITTAGONG Chittagong 740238 2 1211 No No 1050 1,Accord 2013,2025-09-22T21:15:09.031450,19,,22.25003998045143,91.80157356813294,area_match,medium,[],[],0,,0.0,unidentified
"Mohammadi Apparels Ltd 50, Lalbagh Road Dhaka Dhaka 2 9292940 2 16 21 No No  680 1",,Accord 2013,2025-09-22T21:15:09.031512,19,,23.8103,90.4125,default,very_low,[],[],0,,0.0,unidentified
"MOHAMMADI FASHION SWEATERS LTD Ka, 52A Khilkhet DHAKA Dhaka 1229 2 8952710 2 15 11 No No 1350 3",,Accord 2013,2025-09-22T21:15:09.031543,19,,23.8103,90.4125,default,very_low,[],[],0,,0.0,unidentified
"Mohammadi Group Ltd. 52A, Khil Khat Dhaka Dhaka 2 8952704 2 15 21 No No 900 5","Mohammadi Knit star Monna Vobanipur, Mizapur, Gazipur,Dhaka Gazipur Dhaka 1713014147 4 14233141 No No 1216 5 MOHARA ASIAN APPARELS 472, Kalurghat Industrial Area Chittagong Chittagong 670207 3 14 21 31 No No 1500 1 Kafrul ,Mirpur, DhakaDhaka Dhaka 1216 2 9020835 110, Yes Yes 15,6,7 1200 1",Accord 2013,2025-09-22T21:15:09.031574,19,220.0,23.8223,90.3654,exact_location,high,[],[],0,,0.0,unidentified
"Mondol Fabrics Ltd. Nayapara, Kashimpur Gazipur Dhaka 1346 2 9297893 3 19  26  31 No Yes 11, 2 , 3 , 5 , 6 , 7",",2301600 3",Accord 2013,2025-09-22T21:15:09.031787,19,,24.0234,90.3912,exact_location,high,[],[],0,,0.0,unidentified
"Mondol Fashions Ltd. Rashid Tower, Tongabari, Ashulia, Savar, Dhaka Dhaka Dhaka 1341 2 98136846 No No 1200 1",,Accord 2013,2025-09-22T21:15:09.031849,19,,23.8103,90.4125,default,very_low,[],[],0,,0.0,unidentified
"MONDOL KNIT TEX LTD NAYAPARA, KASHIMPUR, GAZIPUR, Gazipur,","GAZIPUR ,Gazipur Dhaka 1346 2 9298557 2 19, No No NA 3200 3",Accord 2013,2025-09-22T21:15:09.031869,19,,24.012521928878062,90.38803436733077,area_match,medium,[],[],0,,0.0,unidentified
Mondol Ltd Building No 3 and 6 13330370 No No 1,,Accord 2013,2025-09-22T21:15:09.031919,19,,23.8103,90.4125,default,very_low,[],[],0,,0.0,unidentified
"Moni fashion ltd Sardagonj, kashimpur, Gazipur Gazipur Dhaka 2 7790594 2 10 20 No No 1400 2",,Accord 2013,2025-09-22T21:15:09.031946,19,,23.8103,90.4125,default,very_low,[],[],0,,0.0,unidentified
"Monira Knit Apparels Ltd. 191, West Masdair, Fatullah, Narayangonj Narayanganj Dhaka 1400 2 7645111 2 11, 25 No No 100 1","Monno Ceramic Islampur, Dhamrai Dhaka Dhaka 1350 2 7730585 2 1121 No No All 2084 1",Accord 2013,2025-09-22T21:15:09.031977,19,,23.8103,90.4125,district,low,['Walmart'],[1.0],1,Walmart,1.0,mass_market
"Monowara Textile Mills Ltd. 225 North Masdair, Fatullah, Narayanjanj, BD 7872331 No No 1",,Accord 2013,2025-09-22T21:15:09.032040,19,,23.8103,90.4125,default,very_low,['Walmart'],[1.0],1,Walmart,1.0,mass_market
"Moon Readywears Ltd. Beron, Diakhali, Ashulia, Savar Dhaka Dhaka 2 7788367 5 16 22 31 41 51 No No 2350 1",,Accord 2013,2025-09-22T21:15:09.032075,19,,23.8103,90.4125,default,very_low,[],[],0,,0.0,unidentified
"Moonlight Garments Ltd K.B. Bazar, Targach, Gazipur, Bangladesh Gazipur Dhaka 1704 1713038976 3 16 23 31 No Yes 10,1,2,3,5 203",,Accord 2013,2025-09-22T21:15:09.032113,19,1143.0,23.8103,90.4125,default,very_low,[],[],0,,0.0,unidentified
"Moonlux Knit Garments Ltd. 7504  7505 Waxbill Plaza, Sumilpara,","Siddhir gonj, Nara yangonjNarayanganj Dhaka 2 8399624 1 16 No No 14 565 2 MOTALEB MONOWARA COMPOSITE Kutubain, Fatllah Narayanjong Narayanganj Dhaka 1420 2 764758 3 17 23 32 No No 1500 1",Accord 2013,2025-09-22T21:15:09.032151,19,,23.618319113191976,90.53727404486379,area_match,medium,[],[],0,,0.0,unidentified
"Mother Colour Ltd. 160, Shashongaon, Enasetnagor, Fatullah,","Nara yangonjNarayanganj Dhaka 2 7671678 1 5 No No 10,1,2,3,4 1000 1",Accord 2013,2025-09-22T21:15:09.106633,20,,23.62067078374038,90.53475957182893,area_match,medium,[],[],0,,0.0,unidentified
"Mozart Knit Ltd Bashaid,Ashulia Dhaka Dhaka 2 8931142 5 1422324451 No No  1589 2",,Accord 2013,2025-09-22T21:15:09.106789,20,,23.8103,90.4125,default,very_low,[],[],0,,0.0,unidentified
"MT SWEATER LTD Gacha, Plot1703 1704, Post Gacha, Gazipur Gazipur Dhaka 1704 2 9293335 1 15 No Yes 10, 1, 2, 3 2000 4",,Accord 2013,2025-09-22T21:15:09.106837,20,,23.8103,90.4125,default,very_low,[],[],0,,0.0,unidentified
"Muazuddin Knit Fashion Limited Plot  B31, East Chandura, Kaliakoir, Gazipur Gazipur Dhaka 1751 1714259169 7 17  26  31  41  51 ",50  701180 3,Accord 2013,2025-09-22T21:15:09.106883,20,,23.8103,90.4125,default,very_low,[],[],0,,0.0,unidentified
"MUAZUDDIN TEXTILE LTD PLOT  235236, EAST CHANDURA, SHIFIPUR,","KALIAKOR , GAZIPURGazipur Dhaka 1751 2 9891363 4 17 27 37 47 No No 6000 8",Accord 2013,2025-09-22T21:15:09.106966,20,,24.01961050972,90.38475973123515,area_match,medium,[],[],0,,0.0,unidentified
"Mukul Knitwear Limited Konabari, Nilnagar, Gazipur Sadar , Gazipur Gazipur Dhaka 2 9297137 1 15 No No No 532 1",,Accord 2013,2025-09-22T21:15:09.107043,20,,23.8103,90.4125,default,very_low,[],[],0,,0.0,unidentified
"Multi Modern Appareals Ltd Yusef Maket, Dhonaid, Yarpur, Ashulia, Savar,","DhakaDhaka Dhaka 1341 1937352696 15 Yes Yes 0,1,2 450 1",Accord 2013,2025-09-22T21:15:09.107069,20,,23.8103,90.4125,district,low,[],[],0,,0.0,unidentified
"Multifabs Ltd Kashimpur, Nayapara, Gazipur Gazipur Dhaka 2 9297450 4 15 27 35 45 No No No 3500 5",,Accord 2013,2025-09-22T21:15:09.107132,20,,23.8103,90.4125,default,very_low,[],[],0,,0.0,unidentified
Multisafh Ltd. PLOT29 32 SECTOR3ROAD4 CEPZSOUTH,HALISHAHARChittagong Chittagong 31 741687 4 11111111 No No 1050 3,Accord 2013,2025-09-22T21:15:09.107158,20,,22.245655542002527,91.80070928857246,area_match,medium,[],[],0,,0.0,unidentified
"Murad Apparels Ltd. 190, Inner Circular Road, Arambagh,","Moti jheel, DhakaDhaka Dhaka 1000 2 7193052 1 18 No No 10,1,2,3,4,5,6,7 375 3",Accord 2013,2025-09-22T21:15:09.107216,20,,23.8103,90.4125,district,low,[],[],0,,0.0,unidentified
Musk Sweater Composite Ltd. Chunji Knit,Ltd.Unit2Shinaboha Mouschak Gazipur Dhaka 1751 2 9884905 No No 1,Accord 2013,2025-09-22T21:15:09.107275,20,,24.01945306718441,90.3792995052104,area_match,medium,[],[],0,,0.0,unidentified
"MYew Fashion Ltd. H.S.S. Complex 2nd Floor, Ka156, Rasulbagh,",MohakhaliDHAKA Dhaka 2 8855659 No No 1,Accord 2013,2025-09-22T21:15:09.107342,20,,23.8103,90.4125,district,low,[],[],0,,0.0,unidentified
"N. T. Apparels Ltd. Dhaka Munshiganj Road, Kashipur, Fatullah,","Nara yanganjNarayanganj Dhaka 1400 2 27640539 2 14, 25 No No No 700 2 N.A Garments Plot  36, Road  46, Gulshan North CA, Dhaka Dhaka Dhaka 1212 2 29884649 1 16 No No No 620 1",Accord 2013,2025-09-22T21:15:09.107386,20,,23.7925,90.4078,exact_location,high,"['Uniqlo', 'C&A']","[1.0, 1.0]",2,Uniqlo,1.0,premium_fast_fashion
"N.A.Z Bangladesh Ltd. 5, Bishuya, Kuribari, Mirzapur, Gazipur Gazipur Dhaka 1700 2 9289054 56 10 1311141 2111111",141112No No 2400 4,Accord 2013,2025-09-22T21:15:09.107509,20,,23.8103,90.4125,default,very_low,[],[],0,,0.0,unidentified
N.A.Z. BANGLADESH LIMITED BHABANIPUR Dhaka Dhaka No No 1,,Accord 2013,2025-09-22T21:15:09.107550,20,,23.8103,90.4125,default,very_low,[],[],0,,0.0,unidentified
"N.K.L. Apparels Ltd. House  52, Plot  238, Satarkul Road,","Abdullahba gh More , North Badda , DhakaDhaka Dhaka 1212 No No 1",Accord 2013,2025-09-22T21:15:09.107573,20,,23.7805,90.4267,exact_location,high,[],[],0,,0.0,unidentified
"N.R.KNITTING MILLS LTD Enayetnagar, Fatullah Narayanganj Dhaka 1400 2 7670177 10 15 211 37 47 56 61",71 81 91 101No No 1600 2,Accord 2013,2025-09-22T21:15:09.107639,20,,23.6167,90.5333,exact_location,high,[],[],0,,0.0,unidentified
N.R.R FASHION LTD A 81 BSCIC IA,"SHASHONGAON ,FATULLAH ,NARAYNGANGNarayangonj 1420 767226061 100 1 14 No No NA 190 1",Accord 2013,2025-09-22T21:15:09.107717,20,,23.613072604004895,90.53300083346922,area_match,medium,[],[],0,,0.0,unidentified
Naba Knit Composite Ltd. Naba Knit Composite Ltd. Zamgora EPZ Road,"Ashulia , Dhaka , BangladeshAshulia Dhaka 1711568575 1 16 No No All 1000 1",Accord 2013,2025-09-22T21:15:09.107780,20,,23.886459164582227,90.1961927250537,area_match,medium,[],[],0,,0.0,unidentified
"Nafa Apparels Ltd. London Plaza, Plot  35, Sector, 3, Uttara Dhaka Dhaka 1230 2 8824422 2 18,18 Yes No 13,4,5,6,7,23,4,","5,6,7,81100 2",Accord 2013,2025-09-22T21:15:09.107860,20,,23.8759,90.3795,exact_location,high,[],[],0,,0.0,unidentified
"Nandan Apparels Ltd. Kathora, Board Bazar Gazipur Dhaka 2 9293530 3 16 11 11 No No 1480 1",,Accord 2013,2025-09-22T21:15:09.107907,20,,24.0089,90.3756,exact_location,high,[],[],0,,0.0,unidentified
"Naomi Sweaters Ltd. A 4647, BSCIC, Konabari Gazipur Dhaka 2 8350948 No No 1",,Accord 2013,2025-09-22T21:15:09.107944,20,,24.0167,90.3833,exact_location,high,[],[],0,,0.0,unidentified
"Nar Sweaters Limited 747, Jajhor, National University, Thana","Joydevpur,DistGazipur.Gazipur Dhaka 1704 981334808 1 16 No No 830 6",Accord 2013,2025-09-22T21:15:09.107968,20,,24.014813675971222,90.38730159716745,area_match,medium,[],[],0,,0.0,unidentified
"Nassa Basics Ltd. 4 Tayebpur, Nischantopur Dhaka Dhaka 1341 2 7790599 1 12 No No 4221 2","National Apparels 13 Ring Road, Shaymili, 1207 Dhaka, BD 2 8114289 No No 1",Accord 2013,2025-09-22T21:15:09.108036,20,,23.8103,90.4125,district,low,[],[],0,,0.0,unidentified
"Natural Apparels Ltd. 464, West Rampura, D.I.T Road, Mollah Tower","4Th  6Th Floor Dhaka Dhaka 1219 85523983322 2 110210 Yes Yes 15,6,7 25,6,7 1050 2",Accord 2013,2025-09-22T21:15:09.108093,20,,23.8103,90.4125,district,low,[],[],0,,0.0,unidentified
"Natural Denim Ltd Tonga Bari, Ashulia, Savar Dhaka Dhaka 1711804303 2 17 22 No No 3000 10",,Accord 2013,2025-09-22T21:15:09.108175,20,,23.8103,90.4125,default,very_low,[],[],0,,0.0,unidentified
"NATURAL SWEATER VILLAGE LTD RAJU TOWER, GOURIPUR,","ASHULIA ,SAVAR ,DHAKADhaka Dhaka 1341 2 7744982 2 14 15 No No 1800 10",Accord 2013,2025-09-22T21:15:09.108198,20,,23.88360028219706,90.19728544917635,area_match,medium,[],[],0,,0.0,unidentified
"Navid woolwear ltd Shaheen complex3rd floor, 23, shataih road,","gazipura, tongi, gazipurGazipur Dhaka 1740 2 8836177 1 11 No No 1200 2 Plot A2, A3 BSCIC Indusrial Estate Enayet Nagar, Fatulla, NarayanganjNarayanganj Dhaka 1420 2 7672828 110 No No 800 1",Accord 2013,2025-09-22T21:15:09.108256,20,,24.01761370765859,90.38232788905135,area_match,medium,[],[],0,,0.0,unidentified
"NAZ KNIT WEAR LTD. ANWAR PLAZA, GANAKBARI,SAVAR,","DHAKA ,BANGLADESHSaver Dhaka 1349 7789624 1 5 No No 15 850 6",Accord 2013,2025-09-22T21:15:09.108387,20,,23.8103,90.4125,district,low,[],[],0,,0.0,unidentified
"Naziat Sweaters Ltd. 309, Challaban Shah Kabir Mazar Road, Uttara Dhaka Dhaka 2 8959916 No No 1","Fatullah , Nara yangonj, Bangladesh.Narayangonj Dhaka 40931902 1 Ground to 2nd floor No No NA 250 2",Accord 2013,2025-09-22T21:15:09.108447,20,193.0,23.8759,90.3795,exact_location,high,[],[],0,,0.0,unidentified
"ND Knit Composite Ltd Rashid Market, Gazirchat, Ashulia Savar, DHAKA ","1344 , BANGLADESHDhaka Dhaka 1344 2 13 27 Yes Yes 12 24, 5, 7 356 2 Need Dresses Pvt. Ltd 11131140, Enayet Bazar Road Chittagong Chittagong 31 633895 1 16 No No 700 1",Accord 2013,2025-09-22T21:15:09.108551,20,,22.253205645791375,91.79801909785401,area_match,medium,[],[],0,,0.0,unidentified
"Needle Drop Ltd 50, Chamdpara, Basin Road, Joydevpur national","universit y, Joydevpur, GazipurGazipur Dhaka 2 8900158 5 13,21,31,41,51 No No 900 1",Accord 2013,2025-09-22T21:15:09.108650,20,,24.012257287637187,90.38019627881702,area_match,medium,[],[],0,,0.0,unidentified
"Neo Fashion Ltd. Vorari, Rajfulbaria, Savar Dhaka Dhaka 1340 1757074733 1 17 No No 1003 5",,Accord 2013,2025-09-22T21:15:09.108749,20,,23.8103,90.4125,default,very_low,[],[],0,,0.0,unidentified
"Network Clothing Ltd. Afiz Complex 4th ,5th and 6th floor Chowdhury","Bari, Vogra, GazipurGazipur Dhaka 1704 2 9252695 2 16  21 No Yes 13,4,5, Roof top ",Accord 2013,2025-09-22T21:15:09.108799,20,700.0,24.016282045092854,90.37862173833479,area_match,medium,['H&M'],[0.86],1,H&M,0.86,premium_fast_fashion
"New Dacca Industries Ltd Sarabo, Kashimpur, Gazipur Gazipur Dhaka 1346 2 8618220 1 11 No No 4911 2",,Accord 2013,2025-09-22T21:15:09.108889,20,,23.8103,90.4125,default,very_low,['C&A'],[1.0],1,C&A,1.0,value_fast_fashion
"New Era Fashions MFRS.BD Ltd Plot  10,11 12 Part ,Sector  8 ,Road 3","CEPZ , Chitta gongChittagong Chittagong 4223 31 740838 1 13, No No 13, 700 1",Accord 2013,2025-09-22T21:15:09.108921,20,,22.249083066179296,91.80039669360069,area_match,medium,[],[],0,,0.0,unidentified
"New Horizon BD Limited Kolma, Savar, Dhaka DHAKA Dhaka 2 7744073 1 3 No No  400 1",,Accord 2013,2025-09-22T21:15:09.108994,20,,23.8103,90.4125,default,very_low,[],[],0,,0.0,unidentified
"New Light Sweaters Ltd Chandana, Joydelpur Road Gazipur Dhaka 1704 1711836757 No No 1",,Accord 2013,2025-09-22T21:15:09.109021,20,,23.8103,90.4125,default,very_low,[],[],0,,0.0,unidentified
"New Line Clothings Ltd Plot No.1945, Kouchaukuri, Kamrangachaia,","Mouchak , Kallokoir , GazipurGazipur Dhaka 2 80234956 1 15 No No  1850 4 New Town Knitwear Co.LTD Plot 345350, Nilnagar Konabri Gazipur Dhaka 2 929714 2 No No 2",Accord 2013,2025-09-22T21:15:09.109043,20,,24.021528738503658,90.38118139445587,area_match,medium,[],[],0,,0.0,unidentified
"Newage Apparels Ltd. Purbo Narshinghapur, Zirabo, Ashulia, Dhaka,",BangladeshDhaka Dhaka 1710912376 5 1328314253 No No 4000 4,Accord 2013,2025-09-22T21:15:09.109151,20,,23.8103,90.4125,district,low,[],[],0,,0.0,unidentified
"NEWAGE GARMENTS LIMITED 42 I, Indira Road, Farmgate DHAKA Dhaka 2 9126535 1 19 No No 1000 1",,Accord 2013,2025-09-22T21:15:09.109219,20,,23.8103,90.4125,default,very_low,[],[],0,,0.0,unidentified
"NEWTECH APPARELS LTD SALEHA COMPLEX, 215 DT ROAD, DEWANHAT,","DOUBLE MOORING THANAChittagong Chittagong 4100 31 2513810 16, Yes No 11,2,3,4,5 630 1",Accord 2013,2025-09-22T21:15:09.109241,20,,22.24632005699664,91.79936588652261,area_match,medium,[],[],0,,0.0,unidentified
"Newtex Design Ltd Gorai, Industrial Area, Mirzapur Tangail Dhaka 1942 1717057826 7 14 22 31 41 51 61",71No No 1100 3,Accord 2013,2025-09-22T21:15:09.109315,20,,23.8103,90.4125,default,very_low,[],[],0,,0.0,unidentified
"Next Sourcing Ltd House 217, Road 10, Mirpur DOHS, Dhaka Dhaka Dhaka 1216 2 8080974 No No 1",,Accord 2013,2025-09-22T21:15:09.177218,21,,23.8223,90.3654,exact_location,high,['Next'],[1.0],1,Next,1.0,premium_fast_fashion
"Nexus Fashion LTD Nexus Tower, Vogra Joydebpur Gazipur Dhaka 2 9252774 No No 1","TaltolaDhaka Dhaka 2 9145910 No No 1 Nexus Sweater Ind.pvt Ltd. Vogra, Joydebpur Gazipur Dh aka 1704 2 9252774 3 18 21 31 No No 1300 8",Accord 2013,2025-09-22T21:15:09.177265,21,179.0,23.9989,90.4203,exact_location,high,[],[],0,,0.0,unidentified
"Niagara Textiles Ltd Chandra circle, UnionAtabaha, Kaliakair Gazipur Dhaka 2 2512334 No No 6","Nice Cotton Rak Tower4th floor, Sector  3, Uttara 1230, Dhaka2 1715243253 No No 1",Accord 2013,2025-09-22T21:15:09.177424,21,,24.05,90.2167,exact_location,high,[],[],0,,0.0,unidentified
"NIGHTINGALE FASHION LTD Plot A 8485 BSCIC Ind Estate, Konabari, Gazipur Gazipur Dhaka 1346 2 9297190 1 18 No No NA 900 1",,Accord 2013,2025-09-22T21:15:09.177520,21,,23.8103,90.4125,default,very_low,[],[],0,,0.0,unidentified
"Nipa Fashionwear Ltd Selina Tower, Holan Road, Islam Bag, Dhaka Dhaka Dhaka 1230 2 8962683 4 18 21 36 41 No Yes 10 7 20 305",402019 7,Accord 2013,2025-09-22T21:15:09.177571,21,,23.8103,90.4125,default,very_low,[],[],0,,0.0,unidentified
"Nirzhor Knitwear Ltd D.N.Road, Pagla NARAYANGANJ Dhaka 1400 No No 1",,Accord 2013,2025-09-22T21:15:09.177612,21,,23.8103,90.4125,default,very_low,[],[],0,,0.0,unidentified
"Nkk Knitwear Ltd. Kutubail,Fatullah,Narayangong Narayanganj Dhaka 1420 1714097821 1 18 No No 969 1",,Accord 2013,2025-09-22T21:15:09.177640,21,,23.8103,90.4125,default,very_low,[],[],0,,0.0,unidentified
"Nofs Garments Ltd. Plot  Holding  1, Turag Housing Ltd., Beribadh,",Mohammad purDhaka Dhaka 2 400 No No 1,Accord 2013,2025-09-22T21:15:09.177679,21,,23.8103,90.4125,district,low,[],[],0,,0.0,unidentified
"Noman Fashion Fabrics Ltd. Pagar, Tongi, Gazipur, Dhaka, Bangladesh Gazipur Dhaka 1710 2 9801012 3 16 24 35 No Yes 15 24 30 886 6",,Accord 2013,2025-09-22T21:15:09.177739,21,,23.8103,90.4125,default,very_low,[],[],0,,0.0,unidentified
Noman Terry Towel Mills Ltd Vawal Mirzapur Gazipur Dhaka 11 14 22 32 41 52 61,72 81 91 101 111No No  2042 3,Accord 2013,2025-09-22T21:15:09.177770,21,,23.8103,90.4125,default,very_low,[],[],0,,0.0,unidentified
"Norban Comtex Ltd. Mouza Sarabo, Chakraborty, Kashimpur Union,","Gazipur, Dhaka,Gazipur Dhaka 2 3341420 Building 1  Storied, Building 2  1 Storied, Building 3  2 Storied, Building 4  2 Storied, Building 5  Under constructionNo No 1690 4 NORP KNIT INDSUNIT2 93 RELIANCE INDUSTRIAL PARK, ISLAMPUR ,KODDA , NANDUN 1700GAZIPUR 2 9264371 5 No No 2025 2",Accord 2013,2025-09-22T21:15:09.177827,21,,24.016726718883202,90.38556478024599,area_match,medium,[],[],0,,0.0,unidentified
"Norp Knit Industries Ltd Unit 1N o r t h Khailkur, National University Gazipur Dhaka 1704 2 9292036 2 1222 No No  1200 3",,Accord 2013,2025-09-22T21:15:09.178048,21,,23.8103,90.4125,default,very_low,[],[],0,,0.0,unidentified
"Norp Knit Industries Ltd Unit 2 Reliance Ind Park, 93,Islampur, Kodda Gazipur Dhaka 2 9264371 2 1322 No No  3700 3",,Accord 2013,2025-09-22T21:15:09.178083,21,,23.8103,90.4125,default,very_low,[],[],0,,0.0,unidentified
"Northern Corporation Limited Plot  4345,BSCIC IA, Tongi, Gazipur Gazipur Dhaka 1710 1833313626 4 15 No No NA 1250 3","Northern Fashion Plot 1618 Dakkin Panishail,EPZ kaliakur road, Kashim pur, Gazipur,DhakaGazipur Dhaka 1819813951 3 172434 No No 1970 2",Accord 2013,2025-09-22T21:15:09.178122,21,,24.01400920868996,90.38543450195121,area_match,medium,[],[],0,,0.0,unidentified
"Novel Hurricane Knit Garments Ltd. Bokran, Monipur, Mirzapur, Gazipur Gazipur Dhaka 1703 1713093770 1 15 No No 519 1","NR EXPORTS House152nd floor, Road30, Sector7, Uttara Model Town , DhakaDhaka Dhaka 1230 1611557722 16 Yes Yes 12 15 1 NR Knit Composite Enayetnagar, Volail, Fatullah Narayanganj Dhaka No No 5 NR Knitting Mills own production Enayetnagar, Bholail, Fatullah Narayanganj Dhaka 2 7670042 1 16 No No  817 2 NRN Fashion House227, Road4, Mirpur, DOHS, Dhaka Dhaka Dhaka 1221 1710877777 16 Yes Yes 15 25 1 NTKC Plot 345350, Nilnagar, Konabari, Gazipur, BangladeshGazipur Dhaka 88029297141 4 110, 28, 34, 44 No No 2115 1",Accord 2013,2025-09-22T21:15:09.178231,21,,23.6167,90.5333,exact_location,high,['C&A'],[1.0],1,C&A,1.0,value_fast_fashion
"Nurani Dyeing  Sweater Ltd. Fatehpur, 2 No Shorshodi Union, Dhaka","Chitta gong Road , FeniChittagong Chittagong 2 9887507 1 15 No No 600 1",Accord 2013,2025-09-22T21:15:09.178510,21,,22.248836097723103,91.79690944658809,area_match,medium,[],[],0,,0.0,unidentified
"NZN Garments Ltd Patherghata 4000, Chittagong Chittagong Chittagong 4000 31 740136740161 1 16, Yes Yes 11, 285 1",,Accord 2013,2025-09-22T21:15:09.178574,21,,23.8103,90.4125,default,very_low,[],[],0,,0.0,unidentified
"OASIS HITECH SPORTSWEAR LIMITED. PLOT 1214  21, COMILLA EPZ COMILLA Chittagong 3500 81 71051 12, No No Not Shared 1000 1","Oasis Unit 2K a s h e m Complex , Gacha Roard , Gazipur Gazipur Dhaka 2 9291812 1 16 No No 987 1",Accord 2013,2025-09-22T21:15:09.178616,21,,24.016983512265597,90.38668664026736,area_match,medium,[],[],0,,0.0,unidentified
"OCEAN APPARELS LIMITED BUILDING DS 02, EAST WING 1ST FLOOR, ROAD","02, CEPZChittagong Chittagong 4223 31 800098 2 1221 No No Not Shared 882 1",Accord 2013,2025-09-22T21:15:09.178703,21,,22.253559740340876,91.8042643202119,area_match,medium,[],[],0,,0.0,unidentified
"Ocean Trousers Ltd Laxmipura, Chandona, Joydebpur, Gazipur Gazipur 29252817 1 16 No Yes 13,4,5 1543 1","Ocenian Fashion IE 43,Chiriakhana Road, Mirpur1 Dhaka Dhaka 1216 2 9020781 No No 280 1",Accord 2013,2025-09-22T21:15:09.178769,21,,23.8223,90.3654,exact_location,high,[],[],0,,0.0,unidentified
"Odessa Fashions Limited Nalzani, Chandana, Joidevpur, Gazipur Gazipur Dhaka 1702 2 9252412 1 16, No No 16, 1960 5",,Accord 2013,2025-09-22T21:15:09.178845,21,,23.8103,90.4125,default,very_low,[],[],0,,0.0,unidentified
"OekoTex Limited South Panishail zerani bazar, BKSP, Gazipur,",DhakaGazipur Dhaka 1711591280 3 162734 No No 1399 1,Accord 2013,2025-09-22T21:15:09.178870,21,,24.015392904979528,90.38514319169748,area_match,medium,[],[],0,,0.0,unidentified
"Oishi fashion  pvt ltd. Shaheen complex,3rd floor 23, shataish","road ,gazipura,tongi, gazipurGazipur Dhaka 1712 2 6557258 1 16 Yes Yes 12,3 475 1",Accord 2013,2025-09-22T21:15:09.178927,21,,24.019809398371834,90.37872378344782,area_match,medium,[],[],0,,0.0,unidentified
"Old Town Fashions Ltd Salima Complex, Silo Road, Siddhirgonj,",Nara yangonjNarayanganj Dhaka 1430 2 7692010 1 14 No No 750 2,Accord 2013,2025-09-22T21:15:09.178987,21,,23.620246966713268,90.52851835488782,area_match,medium,[],[],0,,0.0,unidentified
"Oli Knittings Fabrics Ltd. Ganak Bari, Savar, 1349, Savar, Dhaka, BD 2 7701202 No No 1",,Accord 2013,2025-09-22T21:15:09.179044,21,,23.8103,90.4125,default,very_low,[],[],0,,0.0,unidentified
"Omega Sweaters Ltd. 3B, Darus Salam Road, Mirpur1, 1216 Mirpur,","Dhaka , BD2 8021982 No No 1 One Composite Mills Bishuya Kuribari, Mirzapur Thana, Gazipur Sadar Gazipur Dhaka 1703 2 9289514 No No 2300 1",Accord 2013,2025-09-22T21:15:09.179071,21,,23.8223,90.3654,exact_location,high,[],[],0,,0.0,unidentified
"One Up Sweaters Ltd 122 123, Choydana, P.O. National University Gazipur Dhaka 2 929280 2 No No 1",,Accord 2013,2025-09-22T21:15:09.179169,21,,23.8103,90.4125,default,very_low,[],[],0,,0.0,unidentified
ONE WAY TEXTILE LTD. One Way Textile,"Zirabo, SavarDhaka Dhaka 1340 2 7792460 1 11,2 No No 288 1",Accord 2013,2025-09-22T21:15:09.179334,21,,23.85811119982094,90.2689031011795,area_match,medium,[],[],0,,0.0,unidentified
"ONUS DESIGN LTD ONUS DESIGN LTD, JOY BANGLA ROAD,, KUNIA,","K B BAZARBARA BARI , GAZIPURGazipur Dhaka 1703 2 9291713 1 17, No No NA 2250 1",Accord 2013,2025-09-22T21:15:09.179446,21,,24.016022829694233,90.38540758374826,area_match,medium,[],[],0,,0.0,unidentified
"Opex Fashions Ltd. I1, I2 BlockC,Section 13, Mirpur, Dhaka Dhaka Dhaka 1216 2 9013766 1 19 No No 1400 1",,Accord 2013,2025-09-22T21:15:09.179544,21,,23.8223,90.3654,exact_location,high,['PVH'],[1.0],1,PVH,1.0,other_brands
"Opex Stylewear Ltd 561, BlockC,Section 13, Mirpur, Dhaka Dhaka Dhaka 2 8828860 3 11221039 No No All 4500 2",,Accord 2013,2025-09-22T21:15:09.179589,21,,23.8223,90.3654,exact_location,high,['PVH'],[1.0],1,PVH,1.0,other_brands
"OPTIMUM FASHION WEAR LTD Shashongaon, Enayet Nagar, Fatulla,",Nara yanganjNarayanganj Dhaka 1420 2 7670181 1 16 No No NA 450 1,Accord 2013,2025-09-22T21:15:09.179614,21,,23.612132714930915,90.53818378078567,area_match,medium,[],[],0,,0.0,unidentified
